report,firm,year,industry,chunk_id,text
BCG_2024_AI_Value.pdf,BCG,2024,AI_Value,1,"opportunities, customer- center . The a 30% search a 30% to 40% marketing time. 10 Insurance curve? , technology, (% ) - challenges 9 64 25 2 BCG’s 10-20-70 (%) model / 10% high- Technology compliance 20% at- literacy 0 25 50 75 100 ? processes processes (%) 70% engineers skills HR 77 15 9 23 5 Legal 4 a roadmap , sales, IT 6 Procurement 4 steer administration24 16 distribution13 Finance 4 short- and long- steps 15 25 35 45 55 65 75 Source: Future 2024 ( DAI). again, technol- : - a . concerns, , acquir- commercial/ skills, marketing (30%), and R&D (27%). . technology , drug, , and , real- engage- models. practitioners, providers. and customer via . ( .) GROUP 11AI Biopharma curve? , technology, (% ) - challenges 27 46 19 8 BCG’s 10-20-70 (%) model / 10% high- systems Technology 20% compliance at- 0 25 50 75 100 literacy on a average ? processes (%) , 70% communications, modeling engineers Support Finance making a for 70 27 30 6 a change IT 4 Commercial/ 3 short- and long- steps 30 13 7 7 Legal 3 workflows processes 15 25 35 45 55 65 75 Source: Future 2024 ( DAI). 12 WHERE’S ? L , the 70% struggling, wait- . , ing, planning, to a re- by $300 , revenues, and savings. A . - generate $100 from a GenAI- , , behind. . A a 10% reduc- ’s . 30%, $200 . GROUP 13Overcoming , research, indi- about 70% , about 20% issues, . 10% algorithms ( occupy a groups: ). ( 5.) The - companies • com- transformations, 70% people-- ities, 20% , and 10% . , • A value, , ones— many , over- for. , , , build • , . - right, - , implement- • systems, , - models, latency, costs. Exhibit 5 - , Such BCG’s 10-20-70 challenge (%) / 48% 10% high- 43% 56% AI 48% 20% compliance 46% 37% 66% 59% a initiatives 56% /savings 54% 48% processes a change 42% 70% 38% 37% processes 37% literacy 37% engineers 37% 20 25 30 35 40 45 50 55 60 65 70 Source: Future 2024 ( DAI); n = 1,000. 14 WHERE’S ? - - - . , compiled a . . steps: processes—, product , 1. Set a , technologies, , , , years. . ( 6.) 2. with a balanced platforms, performance. As a processes, - a , “ tions, AI- new . excellence. , data science, , ability 3. higher- programs, . -RoI, amazing, it.” easy-to- . Exhibit 6 - , 70% Be BCG's 10-20-70 capabilities1 4.9% 10% implem t e o n d t e a v lg e o p t h a m nd s 3.5% 8% 4.8% 7.2% 4.4% Cybersecurity 2.2% 20% tools 22% / 1.9% 1.0% 0.4% Third- management 8.4% 7.1% cycles 6.9% 5.5% responsibilities 5.1% 5.1% s v u e p p p r o o r c t e e s d s b e y s governance 5.1% 70% 3.6% 70% - guardrails 3.1% 3.0% guardrails 3.0% 2.6% Product/ 2.4% 2.0% Further capabilities2 7.0% Source: BCG 2024 maturity; n = 1,000. Note: LM = model; ML = . 1Based , uplift ≥5%. 2“” the “ processes” 2%. GROUP 154. far, - , inte- , a data. 40% to 70% as creation. a net 5. company’s vis-à- of 20% to 25% , -to- accelerated capabilities. five tech- years. imple- data, of a , than 10 and attention. 200 . 6. A - end-to- processes, had working, , as 45%. along , making, stage—a its solutions. R&D become a next- leader. a 7. - speed, with a transparency, control, on R&D. prioritized 11 -, -, AI . , software . well-established challenge. - 30% ( ) 40% Here’s - . jump- by 1.5% to 2% overall. journeys. Three- A . behind. The governance, - scale. experience, clear, them. . playbook, a only 10% . , . start —a focused lineage. —to C- ’s scale. processes, lin- eage, metadata, mature, adoption . , make -: , progress. context, insights. a ten- demon- - cross- lineage (source ) information. , a multi- required . 16 WHERE’S ?Appendix Methodology , images. report, AI, (GenAI), DAL-E , below. generation. foundational (LMs)—a - break- . self- . intelligence trends. analytics, , and - data, - a . GROUP 17Methodology report, AI- -. our 2024 Tritad, survey, 1,000 objectives, , than 20 companies’ . 30 . - tion, - context, sector-. 30 capabilities, - from 59 Asia, Europe, stages. ( industries: , energy, financial exhibit.) , , , insurance, public , sector, technology, media, . - . weight- categories: • : 0–25 • : >25–50) • : >50–75) • -built: >75–100) Methodology: Foundational Outcomes Outcomes Governance / C- Product/ - - AI/ Cybersecurity tools Operations Third- tools (RAI) chain Cybersecurity, 4.0 Procurement Partner/ guardrails build Source: Future 2024 ( DAI), n = 1,000. Note: LM = model; ML = ; RAI = . 18 WHERE’S ? Authors a , (Gen) digital Group. , firm’s . contact debellefonds.nicolas@bcg.com. charanya.tauseef@bcg.com. a , is a , and , ’s . X, firm’s . franke.marcroman@bcg.com. .jessica@bcg.com. is a a partner BCG’s . ’s . forth.patrick@advisor.bcg.com. .michael@bcg.com. GROUP 19Amanda a is a BCG’s . firm’s . luther.amanda@bcg.com. .romain@bcg.com. is a a ’s . firm’s . at lukic.vladimir@bcg.com. martin.mary@bcg.com. manager, a firm’s office. strategy, ’s . sassine.joe@bcg.com. nopp.clemens@bcg.com. , Dam, Ignacio authors. Gonzalez, , , , this report. 20 WHERE’S ? , @bcg.com. BCG . receive e- or 1963. Today, others, bcg.com. Consulting embrace a and X ( ). —empowering grow, competitive © Group 2024. reserved. 10/24 advantage, impact. , functional a change. solutions - consulting, technology , ventures. in a and organization, a .bcg.com 22 WHERE’S ?WHERE’S THE VALUE IN AI?"
KPMG_2024_AI_Insurance.pdf,KPMG,2024,AI_Insurance,0,"kpmg.comForeword intelligence (AI), However, has , output (), industries. technology. already , ( - Officers), identify strategy, processes, however, of innovation, adoption, and . trust, accuracy, . So, insurance transformation. ? play, and opportunities, assessment current organizations, action- $79bn by 2033.1 transformation. ‘s risks, Italia, PassportCard, and services, how , ‘s . time- processes. technology — AI, in a . local , requirements. organization.2 Lead, , Director Italy 1 (AI) , Share, 2024 to 2034, , July 2023. 2 ’, , December 2023. 2 © 2024 entities. . reserved. : 1 , : -, global business. However, industries. 2 A : , their . , prioritize. effectively. 3 data- people-led: transformation, a robust , a to output. -, by assistant. 3 ©© eennttiittiieess.. .. rreesseerrvveedd.. authors , , , , 1997 a Claims sector. She 2018. 25 large- , ’s companies. , ’ Italy. . Principal, brings over 20 , 25 architecture, . improve , financial, risk clients. A , reinsurers , Lloyd’s markets. KPMG‘s . Director, 2021 than 15 is a Consulting . China. 19 technology - Asia, growth. co- KPMG’s end-to-end insurance. . leaders, kindly : PassportCard (SAR), China 4 © 2024 entities. . reserved. contents 06 11 insurers AI transformation? 17 23 the 38 29 34 Closing : act 36 professionals 5 © 2024 entities. . reserved.01 landscape 6 © 2024 entities. . reserved.: • introducing . . • and and customer-. • areas, a , more . and (NLP) analyzing, classifying, new data. content. many decades. In 1958, demonstrated a ‘perceptron’, a five- computer that ‘learnt’ 50 for . networks.3 a , exponential , infrastructure. Seventy- in 2024 selectively, 99 .4 the high- AI. A 31,000 31 by that 75 work, half months.5 operational processes. , outcomes, . solve a , the . , deliver cover, . , complete. a US$1.3 by 2032.6 3 , ‘Professor’s — 60 soon’, , , September 2019. 4 ‘ : ’, , April 2024. 5 2024 Report’, LinkedIn, 8 May 2024. 6 a $1.3 by 2032, , Bloomberg. 7 © 2024 entities. . reserved.57% 58% CEOs for a return years.7 .8 years, been a technologies, potential benefits. -, support recognition, provide a chatbots, ‘ actions’ personalization.9 Deep-, technology, and , in a false claim, - taken. However, data. , systems. : , it’s machine already our AI client’s , it’s , data , platforms, management . a AI. As a improve, can the organization. of .” Principal, a . needed. transparency, accuracy, of algorithms. a organization sharing management. 7 ‘ 2023’, , December 2023. 8 ‘ ’, , December 2023. 9 insurance: A change, , March 2023. 8 © 2024 entities. . reserved. , several years. management, capabilities, automation. back- in efficiency. Furthermore, taking a . , around a . When a , , to a human required.“ , Officer , functions , call-centers, marketing, . solve efficient. be a a . of AI, top. , . this, all 15,000 colleagues organization, .“ , Officer Australia, . recognition (OCR) back-office functions, quality . on tailored, , further capabilities. - management, a underwrite little-to- .“ , Officer 9 © 2024 entities. . reserved. models, , pose a transformation. These models, valuable, inflexible, resource- maintain, of frameworks. is a time- , further challenge. . Python a , accurate, . • cost: coding, costs. • accuracy: , reduced, . • : , integration . • : tools, the organization‘s goals. 10 © 2024 entities. . reserved.02 insurers transformation? 11 © 2024 entities. . reserved.: • transformation, . • services, a both. • high-, cloud-, model. optimism. a solutions, tackle a , . the platforms, , human-like text, images, audio, . initiatives, a introduce , . also ( datasets), in . . 34% strategy, schedule. 23% A -/ . 30% . 13% A tested, but a . Source: 2024, , September 2024. 165 . We’ trialing . deployment, evolving, , bias, compliance. taking a .” , , 12 © 2024 entities. . reserved. processes: , playing a landscape. it , experience. As a result, AI, investment. , in part, through a Buy-Build-: Develop a identify - objectives. tools. investment . with a end-to- , business. support . , in business. 47% organizations , featuring business, the of 40%.10 10 2024, , September 2024. 165 13 © 2024 entities. . reserved.: foundation: a that a transformation. review. It’s insurance . cloud- effectively. this. a for , a . and models. the . A call fully -, , close. . as a greater ; however, with organizations. . Understand 17, -360 a 2023, investment. force 2016. engine. With a : a fault, and/ dangerous consequences, AI- making. Therefore, a application.” , , Italy 1144 © 2024 entities. . reserved. Currently, department. this , develop a AI — . critical; doesn’t change, slow.” , Officer a three- Australia. Firstly, our appropriate. A we , -making, going , . Finally, copilot , , .” , Officer 15 © 2024 entities. . reserved. : PassportCard processes, , , and . - a , 200 territories, . PassportCard , , around 95 $250 automatically. remaining 5 staff, afterwards. , PassportCard’s Founder, , points. 2011 12 a expatriates: “ , ,” he says. “ data.” detection, review, 70 . , to destination, trip, , ages, use. real- across 15 could 24 hours. ’s . , a identify average. dangers: “ discriminate,” . Given a , that a customer, or a claim, a human. “ decision, society’s right,” . ready, of . , implemented a service handwriting, , a a sentiment. 30 conception, ‘ play’ work. decisions. , potentially , marketing. However, , price. 16 © 2024 entities. . reserved.03 adoption 17 © 2024 entities. . reserved.: • a , customers. • a measures pillars. includes a , . • AI. 47% capabilities. running value, 43%.11 ? It’s new . organizations, a start with a ; , capabilities. is help. , progress. , , require a . building a house, insurance a developed, before ; ? needed? ’t , a forwards —"
KPMG_2024_AI_Insurance.pdf,KPMG,2024,AI_Insurance,1,"a . It’s a one- success. industry. , . , . ( employee experience), detection, short- organizations.12 11 2024, , September 2024. 165 : ’s ? 12 2024, , September 2024. 165 : - next 2 years? 18 © 2024 entities. . reserved. Leading / the , exploring Strategy functions, . by for , leading and capabilities. organization. , where value. - advancements learning, with collaboration across manual, -time paper- underwriting, analytics, collection. , pricing, loT, assessment, for . products, and configuration RPA. , . . -leading workflow. integration, such automation (RPA) for technologies, smart contracts. Deep in place , setting usage, , for approvals, ethics, . usage, security, Proactively data, with privacy, regulators process using -heavy. , Underwriting, a claims, insurance , . service. enhancements. Operational , readiness 30–40% underwriting. least 50% 80% of processes processes Source: , August 2024. 19 © 2024 entities. . reserved. on a industry , , . a AI, industry, enabling , faster. — Example level vision 1.5 Elementary Strategy & culture 1.5 modeling 3.8 Operational Technology 3.6 Operational Operational risk 1.0 People & 1.9 culture 1.0 Elementary 1.9 1.7 1.5 1.0 1.5 Description 1.0 its 1.6 Elementary 3.6 3.8 and a 3.0 Data & Emerging modeling & risk a 3.6 Operational is a Market-, deploying average solutions Source: , August 2024. : It’s and organization. Once complete, . a maturity , , people, . pace.” , , a rapid enable . , delivers a , . areas, deliver equal () a . 20 © 2024 entities. . reserved. typically a , sometimes. If I , I a that in a -by- my organization. Then, , I business. I needed.” , Officer PassportCard A , telecommunications, adopt . a disruption a ago, . , is a call centers, years. the , implemented.” , Officer 21 © 2024 entities. . reserved. study How a self- center capacity, calls policies. coverage, and quality. efficiency. developed a customer--; - policies, , . - for a operation. deliver a . self-serve, center, , , satisfaction. 22 © 2024 entities. . reserved.04 23 © 2024 entities. . reserved.: • unacceptable. , governance. • . these. • , a consumption. of practices, - . , . discrimination, , , , relations. However, . AI organizations, . These data, information. , . ’s AI-based insurers.14 , to a ethnicity, ‘redlining’ neighborhoods. 1968.15 a . quality, issues. a as a result. results, a , EU’s GDPR. , outcomes . CEOs is a 85% 61% are double-, in systems, with 84 percent cyber- as a .17 adversaries.16 13 ‘ prices’, , December 2012. 14 ‘ ’, Services, July 2024. 15 ‘Redlining’, History, June 2023. 16 ‘ ’, , December 2023. 17 ‘ , , September 2023. 24 © 2024 entities. . reserved.AI- , groups . their , cybercrime. . a , regulatory . It‘s a challenges. We‘ 42001 EU‘s building a controls standards. It‘s is , innovation.“ Director, well- , AI-, . , throughout , deliverable. decipher clean. ’t a conflict information. . a , data frameworks. , Officer . drift, models — review. a Assurance Framework. Locally, around “” vs “”. , Officer 25 © 2024 entities. . reserved. introduces a . company’s base.19 elsewhere, , client trust. data poisoning, output. This - . interference. - well- ‘hallucinating’ a fraud . . , . customers, , example, Plum, India, . - well--. inaccuracies.18 identify ’s a , ’s breaches. ‘,‘ science , guidelines. , , and issues. this, trained around 1,000 colleagues, or ‘‘, 100 . -, we challenges.” , Officer ’t . at a . will , future. , Officer 18 ‘’, Plum, March 2024. 19 ‘ - by 3X ’s assistant’, Quiq, 2023. 26 © 2024 entities. . reserved. . , requires providers, firms, for a clear, not .20 AI- marketing, . be a fast-, Union (EU) 2024, frameworks. 70% insurance become a organization’s success.21 organizations’ . impact, ESG . required centers, 2022 and 2026 of Japan’s consumption.22 2024, for 2023 were 48 2019, services.23 AI . : a caution, AI a . It’s the . 20 ‘ICOBS 2.2 ’, Authority (UK). 21 ‘ ’, , December 2023. 22 ‘Electricity 2024’, Agency, January 2024. 23 ‘ Report 2024’, Google, July 2024. 27 © 2024 entities. . reserved. , . a , . It’s the .” , Officer study Building a real- Beazley, a , a . However, faced a a real-, , models. ‘’; pre- Beazley’s existing technology, policies. process, . The requirements, in a . , , business. 28 © 2024 entities. . reserved.05 assistant 29 © 2024 entities. . reserved.: • recommendations, - solving, a . • a AI, a forward. • processes, be a . A . ’t , damaged. at a ’s in-the- is . Considering a provide a fast, loyalty- years, underway. One , case a . Through a data- services, AI- needed payment. , imaging. case, a severe . AI’s organization. However, . by , replacing them. A ‘ ’ ensure failing. also fail, human . 30 © 2024 entities. . reserved. , intelligence data, -to- . in a functions, a , customers. help insurance, , , to and a .” , Officer From a , . In a years’ time, , to , information.” , Officer time (90%), (85%), creative (84%), more (83%).24 , ’s ‘ . Once’ passes a of a , 2024, organization organizations, options processes.25 policies. ‘straight- rain, an processing’ location, events. specific be a far, to a . . , a insurer, PassportCard. , a commercial insurance, claims. losses, these a , a a or 41% “” a over a . , assess accurately, the its reporting. technology.26 24 2024 Report’, LinkedIn, 8 May 2024. 25 ‘ Once’, , GOV.UK 26 2024 Report’, LinkedIn, 8 May 2024. 31 © 2024 entities. . reserved. online forms, agents. , form . Currently, ordinary, humans. a fully- this a near-. , covering a , location, a . , , . : . best processes — them. Keep a , AI. adoption guidelines,"
KPMG_2024_AI_Insurance.pdf,KPMG,2024,AI_Insurance,2,"risks, ensure . Don’t not a — . a those technology. work many, , others. 32 © 2024 entities. . reserved. from a technological, social, perspective, 10 now. However, that I impact industry, . , long-, assistance. , -assisting, . country, immigration. population base. However, require a strategies, respond.” , Officer insurers, it’s bleeding. create a , information , the workforce. ’t industries — It’s scaled.” , Officer I change a lot. have a website? forms? -. a — a crisis, to a human — I don’t .” , Officer 33 © 2024 entities. . reserved.06 : act 34 © 2024 entities. . reserved. . insurance, . play a for a successful, of , . It‘s a — ’s services . . , AI — . , capabilities . safeguards, insurance unlock a possible. ? all. It’s , fast. : 1 AI models. , pressure. developed, . a on 2 assessment. with a structure, compliance. , . 3 current outcome. . 4 systems, a cases, benefits, . 5 critical. place, business. and roles. 35 © 2024 entities. . reserved.07 professionals 36 © 2024 entities. . reserved. , , agility, . , combining alliances, . -of- solutions. ’ . : • AI 360 . • objectives. • . . • a integration, tuning. • , develop a scalable -ready. • organization. oversight, , - not disappearing. , support, they’ the ’ journey. We’ ‘’. ’re ‘ talk’ the — innovation, KPMG . standards, ISO 42001. , a service KPMG.27 A , to a a . 2023, KPMG its .28 makes a , is a . 27 ‘ cutting-edge, ‘private’ ’, , March 2023. 28 ‘ services‘, , July 2023. 37 © 2024 entities. . reserved. AI ; a a way interest, trust, excellence. -driven, human-centric, .29 Deploy ment and monitoring Strategy and deve lo p m e n t P riv a cy S u n abili V t a y l u e s-l e d KPMGTrustedA I H u m a n -c E e n tric xplain a b ility A c c b o a u t n E v a ytili lu a tio n S afety Trustworthy Datai nt e grit y e n a bl e m e nt a D at Modeling Values-- the integrity, excellence, courage, and ‘’.30 . . a , , usage , day-to- capabilities, , , in a data . , . . : : : Intelligence 2023 Improvement 2023–2024 : Pacesetter: , Services 2024, 2021 Services 2023 : : Integrator/Consultancies 2024 29 ‘ ’, . 2024 30 ‘’, . https://kpmg.com/xx/en/home/about/what-we-stand-for/our-values.html 38 © 2024 entities. . reserved. team Insurance, , Insurance, , E: fpfaffenzeller@kpmg. China E: sashapiro@kpmg.com E: erik.bleekrode@kpmg.com Insurance, , , Advisory, International, , E: jcornic@kpmg. E: sscattaglia@kpmg.it E: mark.longworth@kpmg.com Helstrom AI, Principal, E: james.henderson@kpmg.co.uk E: leanne.allen@kpmg.co. US E: mhelstrom@kpmg.com -Navon , Fintech, , , E: iadesman@kpmg. China E: cleong1@kpmg.com.au E: mark.prichard@kpmg.com Director, , Netherlands Japan E: vandermeijs.sander@kpmg.nl E: sadi.gul@jp.kpmg.com A : Methodology , PassportCard, Australia. specific individuals. , insurers, , articles. identified , , strategy. which evolving. 39 © 2024 entities. . reserved. . kpmg.com a . information, the future. a . KPMG firm. KPMG’s , company’s services. © 2024 entities. . reserved. Limited (“”), a entity. a clients. please .com/governance. document, “we”, “KPMG”, “us” and “our” , (“”), , a entity. Evalueserve. : : -G : August 2024 40 © 2024 entities. . reserved."
KPMG_2025_AI_IDC.pdf,KPMG,2025,AI_IDC,0,": 2025 AS A LEADER FIGURE FIGURE 1 Source: IDC, 2025 July 2025, IDC #US52978525eSee methodology, , criteria. EXCERPT MarketScape: Worldwide Services 2025 (Doc # US52978525). a 2025 intelligence (AI) model. , in 2023. iteration, . , just a consciousness. throughout 2023, excitement C- support. In 2024, initiatives, gaps, cost, use needs, . , in 2025, endless , production- deployments. addressing a . -, - plan , governance, development, AI-ready applications, , data, . to organizations' . , AI, of cycles. services , approaches, investments. prioritization, between line-of-, effective of initiatives. ©2025 IDC #US52978525e 2We clearly ' engagements. own infusion. forward- . assessment, vendors. vendors. include: ▪ , IDC's , remains "" outcomes."" the 2023 study. ▪ their vendor, at a , were "" efficiency,"" ""faster innovation,"" and ""."" surveyed achieved 30% from . ▪ - attribute, , "" team."" Again, 2023 study. CRITERIA broad IDC's market. , : ▪ least $500 calendar year ▪ region (i.e., Americas, EMEA, /Pacific) ▪ (e.g., , managed, support, ) ©2025 IDC #US52978525e 3▪ a functions ▪ assets (e.g., tools, platforms, proprietary solutions) ▪ Go-to- with a providers ▪ . organization's business technology. , your them. A , first, you AI investments, , data, resources. ▪ AI- . AI- will strategy, use cases, governance, AI-augmented workforce. , , business , frameworks, workflow -, employees. can and programs. ▪ . Cost- requires a -for-; AI-; a data, model, ; -infused workflows. approach, foundations architectures, optimization, data modernization, , , prototyping, and . established, . ▪ Skills. - . inevitably ©2025 IDC #US52978525e 4create . Select a certifications capabilities, , . with a (COE) gain recommendations, R&D resources, on- , production. ▪ accelerators. remain a of -. structure, organization, more . concept , chosen . Also, may your / business, IT, workflows. While a provider's ""prebuilt"" 60–80% of 's needs, be a than a solution, . ▪ . as a short- ' . , technical, , . PROFILES IDC's a vendor's MarketScape. , a 's challenges. KPMG After a 's capabilities, positioned 2025 AI services. a three-phased- ""Enable, Embed, "" AI a and ©2025 IDC #US52978525e 5growth foundational, functional, layers. 's , (e.g., Strategy, Workforce, Trust, ) journey ( Jumpstart) clients' AI ( Transformation). investing $4.2 three 's , , 's , - - solutions. created a platform, called Workbench, client- , , audit, Gateway . been a year, including 's five- model, ""taskers"" , tax, functions; ""automators"" release; . a 's , , 's offerings. ""service-as-a-software"" - models. Strengths KPMG's , , alliances, and R&D, offerings, . 's service (particularly onsite), , stakeholders, knowledge users. Challenges KPMG's addressing a broader ( users) firm's services. practice. APENDIX Graph , categories: strategies. ©2025 IDC #US52978525e 6Positioning y- 's . category , now. Under , well a building/delivering . the x-axis, axis, vendor's future . - offerings, , -to- years. the assessed. Methodology , weightings, well- vendors. structured discussions, surveys, leaders, participants, users. interviews, , IDC . , , the vendors, information, - vendor's characteristics, behavior, . (AI) , reason, -correct. evidence, content, and failures. use a variety hardware (e.g., , , AI a service, , devices) (e.g., , AI-, software). IDC's AI (generative, predictive, ). services: ©2025 IDC #US52978525e 7▪ - . ▪ consulting, , IT outsourcing, , , infrastructure spending. a , the . a , both structured. ingest, organize, cleanse, -. services, 's Taxonomy, 2025 (IDC #US52282025, March 2025). A evaluated. IDC's 2025 participating . a capabilities. capabilities a must- buyers. Figure 2 for a services 2025. suggest (business, operational, or technical) . Customers knowledge, - models, co- use cases, engagement's success. ©2025 IDC #US52978525e 8FIGURE 2 Top 10 Engagements, 2025 Q. , . n = 72 Note: on a 1–5, where 1 5 . Source: IDC's , 2025 ©2025 IDC #US52978525e 9LEARN MORE ▪ IDC's Taxonomy, 2025 (IDC #US52282025, March 2025) ▪ : AI- 1.0 (IDC #US53209724, February 2025) ▪ Survey, 2024 (IDC #US52167625, February 2025) ▪ : Automation 2025 Predictions (IDC #US51666724, October 2024) ▪ : 2025 Predictions (IDC #US52634524, October 2024) ▪ Perspective: , 2024 (IDC #US51423724, September 2024) ▪ : 2023 (IDC #US49647023, May 2023) Synopsis a intelligence (AI) model. discusses market. a AI . on a term. "" , an successfully scale,"" Hamel, director, IDC. ""The 20 study , - to AI- ."" ©2025 IDC #US52978525e 10ABOUT IDC Corporation (IDC) , advisory services, , telecommunications, technology markets. than 1,300 , global, regional, technology, , over 110 countries. IDC's , , to - . 1964, IDC is a Group (IDG, Inc.). 140 Building B Needham, MA 02494 USA 508.872.8200 Twitter: @IDC blogs.idc.com www.idc.com , providing , , proceedings. Visit www.idc. . a worldwide, .idc.com/about/worldwideoffices. +1.508.988.7988 .idc.com/?modal=contact_repsales rights. Copyright 2025 IDC. authorized. reserved."
