report,firm,year,industry,chunk_id,text
KPMG_2025_Fintech_Funding.pdf,KPMG,2025,Fintech_Funding,4,"as fintechs, Oak regulatory North, expansion, to . plays. François Assada Partner, Fintech France 24. Tech.eu. “ €40M at €1B valuation.” (8 February 2024). #fintechpulse © 2024 , a and a firms Limited, a . reserved. 37Global insights | — EMEA deals, a still- activity (VC, M&A) 2021-2024* 2021-2024* $90 3,000 $35 2,500 2,637 2,588 2,169 2,167 $80 $30 2,500 2,000 $70 $25 $60 1,747 2,000 1,427 1,500 $50 $20 1,500 $40 $15 1,000 $30 689 1,000 569 $10 $20 500 500 $5 $10 $76.5 $50.6 $27.0 $11.4 $29.6 $29.0 $12.9 $5.4 $0 0 $0 0 2021 2022 2023 2024* 2021 2022 2023 2024* ($B) ($B) M&A EMEA 2021-2024* EMEA 2021-2024* $50 500 $8 62 70 412 $7 56 60 $40 359 400 $6 50 41 279 $5 $30 300 40 $4 30 $20 200 $3 18 102 20 $2 $10 100 $1 $0.4 10 $44.4 $18.7 $6.7 $5.6 $2.5 $3.0 $7.5 $0 0 $0 0 2021 2022 2023 2024* 2021 2022 2023 2024* ($B) ($B) Source: Fintech H1'24, , ( ), * 30 June 2024. #fintechpulse © 2024 , a and a firms Limited, a . reserved. 38Global insights | — EMEA up, adaptation EMEA 2021-2024* -money (VC, M&A) EMEA 2021-2024* $20 624 616 700 $70 600 $60 $57.6 $60.0 $62.7 $15 500 $50 363 400 $40 $40.0 $10 300 $30 168 $16.6 200 $20 $15.4 $5 $14.3 $16.1 100 $10 $5.9 $6.0 $12.2 $15.5 $5.9 $5.2 $6.2 $2.2 $0 0 $0 2021 2022 2023 2024* 2021 2022 2023 2024* ($B) 25th Median 75th Median M&A size ($M) 2021-2024* - ($M) 2021-2024* $70 $108.1 $60.3 $60 $50 $82.2 $78.9 $43.0 $40 $34.5 $38.7 $30 $28.8 $46.0 $20 $29.1 $19.5 $19.0 $10 $11.1 $11.7 $11.0 $12.2 $5.6 $0 $6.3 $7.1 $5.4 2021 2022 2023 2024* 2021 2022 2023 2024* Source: Fintech H1'24, , ( ), * 30 June 2024. Pre-seed/ growth M&A 2024 a non- size. The 2023 - on a non- size; all 2024 . #fintechpulse © 2024 , a and a firms Limited, a . reserved. 39Regional insights — EMEA momentum, occur activity (VC, M&A) 2021-2024* #fintechpulse © 2024 , a and a firms Limited, a . reserved. 40 5.82$ 2.61$ 6.91$ 2.21$ 8.91$ 1.41$ 9.9$ 8.6$ 4.4$ 5.3$ 8.31$ 4.5$ 4.3$ 1.8$ $30 900 800 $25 700 $20 600 500 $15 400 $10 300 200 $5 100 $0 0 Q1 Q2 Q3 Q4 Q1 Q2 Q3 Q4 Q1 Q2 Q3 Q4 Q1 Q2 2021 2022 2023 2024 ($B) 0.12$ 2.7$ 7.11$ 6.4$ 3.9$ 6.2$ 8.3$ 0.3$ 9.0$ 7.0$ 1.4$ 0.1$ 5.1$ 1.4$ | M&A EMEA 2021-2024* $25 120 100 $20 80 $15 60 $10 40 $5 20 $0 0 Q1 Q2 Q3 Q4 Q1 Q2 Q3 Q4 Q1 Q2 Q3 Q4 Q1 Q2 2021 2022 2023 2024 ($B) Source: Fintech H1'24, , ( ), * 30 June 2024. — EMEA Q2 tallies 2021-2024* #fintechpulse © 2024 , a and a firms Limited, a . reserved. 41 1.7$ 7.8$ 0.7$ 9.6$ 3.9$ 4.01$ 9.5$ 4.3$ 3.3$ 6.2$ 2.3$ 8.3$ 6.1$ 9.3$ $12 800 700 $10 600 $8 500 $6 400 300 $4 200 $2 100 $0 0 Q1 Q2 Q3 Q4 Q1 Q2 Q3 Q4 Q1 Q2 Q3 Q4 Q1 Q2 2021 2022 2023 2024 ($B) Pre-seed/Seed 3.3$ 1.3$ 5.3$ 3.2$ 8.5$ 0.5$ 9.2$ 9.1$ 8.1$ 0.1$ 5.0$ 6.2$ 6.0$ 6.1$ | EMEA 2021-2024* $7 250 $6 200 $5 150 $4 $3 100 $2 50 $1 $0 0 Q1 Q2 Q3 Q4 Q1 Q2 Q3 Q4 Q1 Q2 Q3 Q4 Q1 Q2 2021 2022 2023 2024 ($B) Source: Fintech H1'24, , ( ), * 30 June 2024. | EMEA Top 10 in H1 2024 1. Group — $4B, Slough, UK — Institutional/B2B — 4 1 10 buyout 8 5 2. Abound — $999.6M, London, UK — — Series B 77 3. Gruppo — $652.6M, Milan, Italy — Payments — Corporat e 2 divestiture 3 6 4. Monzo — $621M, London, UK — Banking — Series I 99 5. Pagero — $429M, Gothenburg, Sweden — Institutional/back-office — M&A 6. Flagstone — $174.85M, London, UK — Back-office — 7. Pliant — $163M, Berlin, Germany — Payments — Series A 8. Revolut — $139.4M, London, England — Payments — Late- 9. Voxel — $127.8M, Barcelona, Spain — Institutional/back-office — M&A 10. Cloover — $114M, Stockholm, Sweden — Institutional/B2B — Seed Source: Fintech H1'24, , ( ), * 30 June 2024. #fintechpulse © 2024 , a and a firms Limited, a . reserved. 42Global insights | In H1 2024, fintech (ASPAC) received $3.8B with 438 deals #fintechpulse © 2024 , a and a firms Limited, a . reserved. 43Global insights | — ASPAC Authors: , Fintech, Teper, Fintech, A $3.7 billion; Q2’24 since Q3’17 AI-, service $4.6 H2’23 to $3.7 H1’24, despite a answer 406 to 438 . ; . H1’24 included a $280 - ’ Enterprise, a $209 - KreditBee, a $195 - Ascend, and $150 - use Australia- Camms. cases. During H2’24, we’ continue grow, Key H1’24 - include: , will lull, . still a China region, to H1’24, , $624 , India, Singapore, Australia, during H1’24, $754.6 H2’23. Despite . M&A -, PE, and M&A investment, H1’24, with M&A a ’s $300 government, as $7.8 million. cautious — priorities: , , inclusive , , , finance.25 of strategy, China’s is . support — time. the in H1’24 $150 by .26 25. (NFRA). “- .” (n.d.). 26. Startup “ ” (26 January 2024). #fintechpulse © 2024 , a and a firms Limited, a . reserved. 44Global insights | — ASPAC ; solutions A the in H2’24 years investors • focus maturity. We , following a across privacy. ’t , more globally. During H1’24, players — likely • put a . , Middle reopen, the efficiencies. East, , Asia. well and , however, as • offerings, quite they’ nascent, come. sector. quite a critical • A circumstances. back H2’24 or H1’25. end, we’ a market as a result. 2023, , • A empire ; , , a subsectors, . easily. ,"
KPMG_2025_Fintech_Funding.pdf,KPMG,2025,Fintech_Funding,5,"however, , of . , propositions, Partner, M&A . #fintechpulse © 2024 , a and a firms Limited, a . reserved. 45Global insights | — ASPAC a slow 2023 activity (VC, M&A) 2021-2024* 2021-2024* $60 1,834 2,000 $25 1,664 1,800 1,587 1,432 1,600 $50 $20 1,400 1,500 $40 1,200 985 $15 864 1,000 $30 1,000 800 $10 $20 438 402 600 500 $5 400 $10 $3.8 200 $30.1 $50.3 $12.5 $22.3 $14.8 $10.9 $3.5 $0 0 $0 0 2021 2022 2023 2024* 2021 2022 2023 2024* ($B) ($B) M&A ASPAC 2021-2024* 2021-2024* $40 145 160 $3,000 26 30 25 129 $35 140 $2,500 25 $30 103 120 18 $2,000 20 $25 100 $20 80 $1,500 15 $15 60 $1,000 10 31 $10 40 5 $500 5 $5 20 $5.3 $33.9 $1.3 $0.3 $2,483.5 $1,646.1 $321.2 $7.8 $0 0 $0 0 2021 2022 2023 2024* 2021 2022 2023 2024* ($B) ($M) Source: Fintech H1'24, , ( ), * 30 June 2024. #fintechpulse © 2024 , a and a firms Limited, a . reserved. 46Global insights | — ASPAC , levels ASPAC 2021-2024* -money (VC, M&A) ASPAC 2021-2024* $14 715 800 $120 $111.1 $12 605 700 $100 600 $84.4 $10 $83.5 $80 500 $8 $72.5 400 $60 315 $6 300 $45.6 $4 171 200 $40 $23.1 $22.1 $2 100 $20 $15.7 $7.5 $8.2 $13.6 $13.0 $8.4 $7.3 $1.8 $5.7 $0 0 $0 2021 2022 2023 2024* 2021 2022 2023 2024* ($B) 25th Median 75th Median M&A size ($M) 2021-2024* pre- ($M) 2021-2024* $30 $27.9 $574.0 $25 $432.0 $20 $16.5 $341.7 $15 $289.9 $10 $10.0 $9.9 $5 $75.0 $43.5 $40.6 $16.7 $15.3 $49.2 $11.6 $28.8 $0 2021 2022 2023 2024* $4.8 2021 2022 $6.9 2023 $6.6 2024* $11.0 Source: Fintech H1'24, , ( ), * 30 June 2024. M&A 2024 a non- size. pre- 2022 and 2023 Pre-seed/ growth on a non- size; all 2024 . #fintechpulse © 2024 , a and a firms Limited, a . reserved. 47Regional insights — ASPAC a muted 2023, activity (VC, M&A) 2021-2024* M&A 2020—2024* #fintechpulse © 2024 , a and a firms Limited, a . reserved. 48 5.3$ 9.6$ 8.7$ 9.11$ 8.63$ 4.7$ 3.3$ 8.2$ 7.4$ 2.3$ 5.2$ 1.2$ 0.2$ 8.1$ $40 600 $35 500 $30 400 $25 $20 300 $15 200 $10 100 $5 $0 0 Q1 Q2 Q3 Q4 Q1 Q2 Q3 Q4 Q1 Q2 Q3 Q4 Q1 Q2 2021 2022 2023 2024 ($B) 1.0$ 5.0$ 7.0$ 0.4$ 6.03$ 2.2$ 7.0$ 5.0$ 2.0$ 4.0$ 2.0$ 4.0$ 1.0$ 2.0$ | M&A 2021-2024* $35 60 $30 50 $25 40 $20 30 $15 20 $10 10 $5 $0 0 Q1 Q2 Q3 Q4 Q1 Q2 Q3 Q4 Q1 Q2 Q3 Q4 Q1 Q2 2021 2022 2023 2024 ($B) Source: Fintech H1'24, , ( ), * 30 June 2024. — ASPAC 2021-2024* M&A 2020—2024* #fintechpulse © 2024 , a and a firms Limited, a . reserved. 49 3.3$ 1.4$ 0.7$ 8.7$ 7.5$ 3.4$ 6.2$ 2.2$ 4.4$ 8.2$ 2.2$ 5.1$ 9.1$ 6.1$ $9 600 $8 500 $7 $6 400 $5 300 $4 $3 200 $2 100 $1 $0 0 Q1 Q2 Q3 Q4 Q1 Q2 Q3 Q4 Q1 Q2 Q3 Q4 Q1 Q2 2021 2022 2023 2024 ($B) Pre-seed/Seed 5.1$ 0.2$ 8.4$ 8.4$ 2.3$ 6.2$ 4.1$ 3.1$ 3.3$ 1.2$ 0.1$ 0.1$ 8.0$ 0.1$ | ASPAC 2021-2024* $6 250 $5 200 $4 150 $3 100 $2 50 $1 $0 0 Q1 Q2 Q3 Q4 Q1 Q2 Q3 Q4 Q1 Q2 Q3 Q4 Q1 Q2 2021 2022 2023 2024 ($B) Source: Fintech H1'24, , ( ), * 30 June 2024. | ASPAC Top 10 in H1 2024 1. Yi’ — $280.9M, Shanghai, China — B2B/information — Series B 1 2. KreditBee — $209.4M, Bengaluru, India — Lending — Series D 10 4 3. Ascend () — $195M, Bangkok, Thailand — Institutional/B2B — Late- 7 8 4. MioTech — $150M, Shanghai, China — AI — Series C 3 2 9 5. Camms — $150M, Melbourne, Australia — Institutional/B2B — Add-on 6. Bridgit — $139.6M, Sydney, Australia — Proptech — Series A 7. — $100M, (SAR) — Blockchain/crypto — Series A 8. — $100M, (SAR) — Institutional — Late- 6 5 9. SwiffyLabs — $100M, Bengaluru, India — Lending/payments — Add-on 10. Finance — $90.45M, Qingdao, China — Lending — Early- Source: Fintech H1'24, , ( ), * 30 June 2024. #fintechpulse © 2024 , a and a firms Limited, a . reserved. 50Global insights | | with , . of customer expectations, continued . , the opportunities. over 50 world, the change, , plans. .com/financialservices #fintechpulse © 2024 , a and a firms Limited, a . reserved. 51Global insights | | M&A #1 “2023 World’s the ” , 2023 M&A : M&A Services 2022-2023 report. 70 the “2023 World’s ,” 27 an M&A Innovator, a one- study: 2023. , , firms. , top . in “” and “third the a - assurance,” , rating, “ recommended” . insights, Additionally, the globe. marketing. for “ consulting” in “cyber - security” . clients globe. #fintechpulse © 2024 , a and a firms Limited, a . reserved. 52Global insights | | contributors We’d of . , M&A , Lead, , Insurance Partner E: andrew.huang@kpmg.com E: danteper@kpmg.com.au E: jamesbrannan@kpmg. US E: sashapiro@kpmg.com Partner, Director, Fintech, , E: annamacfarlane@kpmg.co.nz E: dremue@kpmg.com E: karim.haji@kpmg.co. Lead E: rruark@kpmg.com , Director, Dann Singapore E: kenji.hoki@jp.kpmg., Delivery E: antonyruddenklau@kpmg.com.sg E: debarshibandyopadhya@kpmg.com. International E: sdann@kpmg.ca Director, , , US E: lfegan@kpmg. , Principal, E: ericjwest@kpmg. Services François , , Advisory Partner, Advisory, Partner, E: cjacco@kpmg. France E: long1@kpmg.com.sg E: fassada@kpmg.fr E: tejohnson@kpmg.com Partner, , , Banking & E: christ.steele@kpmg.co.uk E: hannah.dobson@kpmg.co.uk E: mmusso@kpmg.com.au , Payments Mishra Partner, , Principal, Zealand E: iadesman@kpmg.com E: pritimishra@kpmg.co.nz E: chtrimble@kpmg.com #fintechpulse © 2024 , a and a firms Limited, a . reserved. 53Global insights | | report Methodology (the ‘Dataset’) capital: Data, Inc (‘PitchBook’) on 30 ; however, - 2024 rounds, included. off - actually Angel, seed/pre-seed, seed: https://pitchbook.com/news/articles/pitchbook-report- employed. the methodologies. /Growth: : (including . , is a venture- PitchBook capital) (‘VC’), (‘PE’) , such."
KPMG_2025_Fintech_Funding.pdf,KPMG,2025,Fintech_Funding,6,"Finally, of Acquisitions (‘M&A’) within if a 2018. Growth: E or . friends, a financing, . seed, and Dataset. / that a a , , $500,000 category. definitive, industry- by a , such. fundings investors, then a as 30 June 2024. Similarly, stated. Pre- a investors, that PitchBook’s light, 2024 edition; a PitchBook’s website. (in a ) and . growth/, Early-: A or fund in B ( ) growth. buyout (‘LBO’); , general M&A or, ; -in; add- - unavailable, by a factors, ; ; private; . , history, , privatisation; ; /expansion. . Late-: C or D 2023 ( . source. be stage) or, if investor. from , by a factors, including investors, , , venture company, history, , , . . #fintechpulse © 2024 , a and a firms Limited, a . reserved. 54Global insights | | report Methodology (cont’d) M&A , verticals, 5. Insurtech — required a speed, efficiency, processes M&A as a company approach: chain. quote purchases a company. Eligible , , acquisitions, 1. Payments/transactions — (), peer-to-, corporate (LBOs), , , of platforms, , , underwriting equals, spin-offs, acquisitions. as a both B2B and B2C transfers. software, . liquidity, self- internal 2. Blockchain/cryptocurrency — core . 50 the 6. Wealthtech — primary (blockchain) transaction. and/ to transactions ( a 50-) included. , cryptocurrency (e.g. bitcoin). . 2023, model. cryptocurrency, the included. qualitative cryptocurrency, using research. activities. 7. Regtech — provide a technology-driven A technology, of 3. Lending — - uses a to or fraud. . . 8. AI & ML, ESG — AI & ML, meaning 4. Proptech — alike. & , help “ models, etc. , utilising purchase, management, funding internet, blockchain, - (e.g. cleantech) and estate. vertical. sub- , loans, payments, , as devices, services, addressing , tools, modeling . software, , marketplaces, machines, point-of-.” websites. report, defined a - #fintechpulse © 2024 , a and a firms Limited, a . reserved. 55Some entities. kpmg.com/uk a . information, . on after a . © 2024 , a and a , a . reserved. : CREATE: CRT157063A| August 2024"
KPMG_2025_AI_Reporting.pdf,KPMG,2025,AI_Reporting,0,": Navigating era leaders’ KPMG. Difference. kpmg.com/NavigatingAIinAuditForeword auditing. - , . Further, a factor, insights. that — joined- and a . go? AI- , - , a — a far-? 1800 a — a : the ‘’ ‘’ . overcome — security — , , , - into a before — - AI- processes. , a . Officer reporting. a AI, and risks. . experience, such advancements. a practices, Approach. , firms’ Sebastian Stöckle transparency, explainability, accountability. Innovation, both ’ itself. real- of , transformation. Welcome, future, what’s corner. © 2024 entities. . reserved. : | 2Contents 04 18 to 06 hurdles — and Objectives, methodology 21 framework them 08 AI- 24 — grow dramatically 13 too — 26 ahead way © 2024 entities. . reserved. : | 3Key findings Geographies, sizes. reporting: & clarifies, : size: . - financial reporting, to 39 32 29 49 35 25 99 percent % % % % % % years. Over $10 billion $5-10 $5 billion and substantively: : 10 percent • A I for 41 35 32 31 31 26 rise % % % % % % significantly 100 percent • said Energy, retail AI. © 2024 entities. . reserved. : | 4AI auditing — lead 64% Benefits* Barriers* Leaders Leaders: Leaders: Leaders: • • • impacts (65 percent) (49 percent) • overcome a • Real- • (45 percent) , (60 percent) • . • - (42 percent) • (57 percent) to • concerns • accuracy (42 percent) (57 percent). • of • with purposes: AI-readiness oversight (40 percent) 01 audits: the management. 02 proactive, continuous, processes: prioritize • ambition — function? AI . ? ? ? - insights: Many • assessment — ’s assessment? 03 AI’s ? ? . • ambition, strategy — sufficiently? and frameworks? reporting? , • support — . As a KPMG’s . 65 , fairness, transparency, explainability, accountability, , , 55 reliability, security, safety, privacy, , is a , build, deploy, . a , communities. Further, , a techniques. 57 . reporting years. * © 2024 entities. . reserved. : | 5Objectives on a 1800 companies across 10 countries. Objective: on a 1800 10 countries. function, , and . Methodology: at 1800 , , . include: • (CFO, CAO) making , accounting, analysis, audits, information. • $250 over $1 . • include: Australia, Canada, France, Germany, Japan, Ireland, Netherlands, UK, Spain. • : Consumer & Retail, Energy, , & Chemicals, Healthcare & , , Telcom & Technology, and February — March 2024. US Spain © 2024 entities. . reserved. : | 6AI , a questions: company Leaders ? ? a) : a) / usage 24% b) Planning: Beginners b) for c) Piloting: and third- 52% c) d) : processes 24% d) attestation e) : for a financial reporting e) - processes • questions, a -readiness groups: Leaders, Implementers, . • company, : • Leaders: top 25th percentile • Implementers: 25th 25th percentiles • Beginners: bottom 25th percentile © 2024 entities. . reserved. : | 7AI- changing the becomes grow . 10 percent in dramatically , 72 selectively, 27 so. years, companies (99 percent) AI. research, a more reporting. They with . framework, 24 organizations ‘Leaders’, 52 percent ‘Implementers’ and 24 are ‘Beginners’ in stages. industries. , with 41 widely process, energy, , (35 percent). Consumer , however, industries. findings, (32 percent), manufacturing (26 percent), (25 percent); with (22 percent) healthcare/ (22 percent) (18 percent). © 2024 entities. . reserved. : | 872% , pace (39 percent), Europe (32 percent) Pacific (ASPAC) (29 percent). , be a AI AI- reporting. 10 largest . regions. companies, $10 billion, while untouched. For , under $5 revenue. 99% , just a , but a of , companies. accounting a whole.” Figure 1. Figure 2. Sebastian Stöckle Innovation, Technology, Media & Telecoms 24% 44% 32% 23% 50% 27% 23% 51% 26% 21% 54% 25% ASPAC Energy, 22% 53% 25% Europe 26% 51% 23% & chemicals Figure 3. size Healthcare & lifesciences 29% 49% 22% Over $10 billion 22% 39% 40% 27% 51% 22% $5 to $10 billion 24% 51% 25% Consumer & retail 20% 62% 18% Under $5 billion 25% 58% 17% Leader ©© eennttiittiieess.. .. rreesseerrvveedd.. : | 9Broader 4. company’s Leader Technology, Media, Telecoms With ‘traditional’ automation (RPA) for 5+ , 10.80% 12.30% A ago, a is, , impossibility . A . Now, while full 86 10.10% 12.40% still a , business. determine years, phase, (99 percent) . in a 9.90% 12.10% Excel. this, significant investment. — 10 . 9.90% 11.80% . ’s simply by 25 retail .” , 25 to 99 percent 9.90% 12.40% years. Energy, Resources, Chemicals as a whole. Leader 9.30% 10.80% Generally, telecoms (10.8 percent), manufacturing (10.1 percent) (9.9 percent), markets (9.9 percent) as a 9.20% 13.00% budget, / (9.3 percent), / (9.2 percent) slightly less. here, spending 12.1 their . more, (both 13 percent). , industry. be those a . Tellingly, not a survey regions, . gap, 42 . companies (67 percent), a Union (EU) company- , 61 , a . a usage, and 51 percent plans. EU’s strategy. Some 47 , and 44 percent © 2024 entities. . reserved. : | 10have , , AI-. (39 percent) cloud (36 percent), (34 percent). when/ to areas, , almost 100 — - done. will — genAI, monitor (40 percent) next 1-2 years. evolve — . support, - in , public . and than , ‘literacy’. , advanced . , 65 have , exact , 55 , ‘hard-coded’ . . genAI, . A continuous a speak, meaning them, — . . genAI a tool, , summarizer, detector. .” become a advantage — new content, analysis, . , a — processes: . Assurance 30 , 11 , , and 2 it. . , with 30 and 8 . : 15 percent genAI — analytics — for . 11 all. next . crucial, , : 57 models reporting — and 75 Leaders. . — companies, priority, but , genAI. put . , is a Indeed, . a competitive technology."
KPMG_2025_AI_Reporting.pdf,KPMG,2025,AI_Reporting,1,"(47 percent) reporting, , , reporting, , a , at 44 percent. . © 2024 entities. . reserved. : | 11Figure 5. Top technologies by enhance 84% 72% 57% 47% 37% 34% AI technology year 47% 44% 39% 36% 34% 33% tools © 2024 entities. . reserved. : | 12AI — and the understanding to value. process, provide - of businesses, investors, professionals.” , Officer, Audit © 2024 entities. . reserved. : | 13Just lion’s companies (82 percent) their process, auditors — for . Another 85 . ’s well, . when , of a Interestingly, a , the have a understanding. -’s , AI. Importantly, to (65 percent) , AI. . (vs. 40 , and , ) AI. ’s a ‘’ occurs it. -thirds (63 percent) and 60 AI. errors. be a triple . companies, information . users. quality, .” Partner purposes: Spain audits - . , detection. proactive, continuous, processes analysis, to - year. - insights ’s that analysis. © 2024 entities. . reserved. : | 14Figure 6. 64 53 34 24 represents a % % % % artificial intelligence, ago. , companies of Third- 2026. ’s compliance. Partner — 59 assessment, while future, a much 37 third- AI . investing reporting, focus, Approach controls. - respondents (64 percent) AI. However, a . example, . (53 percent) ’s assurance , while a reviews, this. - businesses, particularly . of. © 2024 entities. . reserved. : | 15GenAI 7. 55% (genAI) as a . faster — 18 months. 54% management AI — , genAI’s patterns 49% . Risk/ controls, , and 43% . 38% , higher- . , 37% 41% . 37% Real- year 35% : 40% 1. . leverage 32% delivery 37% . 2. delivery. 32% , anomalies, , value- insights responsiveness. 3. . /challenge 31% automated , , 29% summarization. trends © 2024 entities. . reserved. : | 16KPMG & Microsoft . growth. a KPMG analytics, process, , 85,000 . , our 90,000+ a higher-risk 145 complex — two , sector- — markets. same. , bringing a professionals.” • Al-driven • ”Risk-to-response” D Audit • i A n u c d lu it d i & n g A E ss S u G rance k fl o w ita l A u • a A n l- a d l r y i t v i e cs n coverage • m Gl e o t b h a o l, d r o is lo k g -b y ased W o r u alit y E ffi c ie n d g • client Q KPMG c y Clara forefront C of • -way G o n n e g ht s a ti o n • Real- and a e u x d p i e t r g n a c n e d a fi n n d a a n c c c i e al l e p t o e r i t n in n g o v to a t u io p n le . v W el i t e h m th p e • • c T G a o r i m o lo u m r p e u d a n u s i d c c i a o t t o p io r in n a g ccess r o u p A u d it c tivity I n si nt C oll a b o r • t t In e as t a e k m r a tr c a t c io k n in g i C t n o l t o g e u e g d t r h , a e t f i u r o r w n th e o e f a r A r e e I n c i h n r a n e n o a c t v i e a n d t g i o b m n y s o K r a P e c M r v o a G s lu s ’s e t h A a e n u d d M i a t i c c e h r x o i p e s e v o r i f n t t i g s e, a result.” • insights Officer Microsoft © 2024 entities. . reserved. : | 17Example AI a myriad . (65 percent), real-time (60 percent), - (both 57 percent). , , . Over 4 10 , to 6 10. Similarly, help from 36 percent 47 . increases from 32 42 27 36 percent. time. , (65 percent), accuracy (57 percent), costs (52 percent). . , only 33 high . , have . value- anomaly detection (65 percent), RPA (58 percent), machine learning (58 percent), (53 percent), (50 percent). Chatbots (31 percent) and (19 percent) . © 2024 entities. . reserved. : | 18In , Figure 8. reporting. detection, while RPA, . 65% 71% 63% 70% essential AI adoption. migration, cybersecurity, workflows, 58% 62% 56% 66% , bookkeeping. Tech, media, telecoms workflows, , automation consistency, efficiency, produce accurate, timely, seamless 58% 60% 57% 64% Tech, media, telecoms . Paperless integration learning process. 53% 61% 51% 59% Tech, media, telecoms processing 50% 58% 48% 59% Tech, media, telecoms 33% 36% 32% 38% genAI- auditing. Tech, media, telecoms , .” 31% 34% 30% 36% Healthcare, and Canada 19% 24% 18% 24% Tech, media, telecoms © 2024 entities. . reserved. : | 19Figure 9. is a . 67% 87% 60% , under- hyped. , businesses 65% 78% 61% insight. AI , a workflows more 65% 78% 61% on rich, real-. this more 60% 73% 56% .” 60% 72% 56% & Innovation basis 45% 59% 40% quality 45% 60% 40% 37% 58% 30% © 2024 entities. . reserved. : | 20Barriers — , organizations’ concerns they . ways, these barriers, where a curve, follow a similar ‘S"
