report,firm,year,industry,chunk_id,text
KPMG_2025_AI_Trust.pdf,KPMG,2025,AI_Trust,0,"Trust, attitudes intelligence A 2025 Melbourne | unimelb.edu.au | kpmg.comCitation Gillespie, N., Lockey, S., Ward, T., Macdade, A., & Hassed, G. (2025). Trust, artificial intelligence: A 2025. . DOI 10.26188/. Trust, : A under a Attribution, Non-Commercial, 4.0 . use, share, - only, as (s) . changes material, information, graphics, etc, , . licence, . - conditions. Team Gillespie, Lockey, , , Hassed. design, conduct, , analysis, research. , a board, experts, research. Acknowledgments : , , , , , , , , , , , , , , , Ed O’Brien, , Boele. , , , , , , Tapani-Rinta-Kahila, , -Jones, , , , , , , , Jay. . : , , , , , Hardisty. Funding of , International, , Melbourne. . © 2025 . Trust, AI: A 2025 | 2 © 2025 entities. . reserved.Contents figures 2 4 Introduction 11 conducted 13 Section 1: 18 • ? 19 • ? 27 • ? 37 • AI? 47 • acceptance systems? 59 • , attitudes ? 62 Section 2: 66 • work? 67 • work? 77 • ? 85 Section 3: 89 • students? 90 • education? 93 implications 96 Appendix 1: 104 Appendix 2: 107 Appendix 3: country 109 Appendix 4: for 17 countries 110 © 2025 . Trust, AI: A 2025 | 1 © 2025 entities. . reserved. figures Figure 1: personal, work, purposes 20 Figure 2: on a semi- 21 Figure 3: AI- 22 Figure 4: Self- knowledge 22 Figure 5: Self- efficacy 22 Figure 6: , groups 23 Figure 7: , efficacy, 24 Figure 8: 25 Figure 9: systems 28 Figure 10: 29 Figure 11: 30 Figure 12: groups 31 Figure 13: 32 Figure 14: 33 Figure 15: countries 34 Figure 16: in 2022 and 2024 35 Figure 17: use 38 Figure 18: 39 Figure 19: 40 Figure 20: use 41 Figure 21: 43 Figure 22: 44 Figure 23: 45 Figure 24: 49 Figure 25: 50 Figure 26: 51 Figure 27: 52 Figure 28: misinformation 53 Figure 29: mechanisms 54 Figure 30: 56 Figure 31: 57 © 2025 . Trust, AI: A 2025 | 2 © 2025 entities. . reserved. ’d Figure 32: A 60 Figure 33: , income, education, training 64 Figure 34: , income, 64 Figure 35: age, income, 65 Figure 36: () 67 Figure 37: 68 Figure 38: time 69 Figure 39: 70 Figure 40: work 71 Figure 41: work () 71 Figure 42: 72 Figure 43: 73 Figure 44: 76 Figure 45: 76 Figure 46: employees 78 Figure 47: 79 Figure 48: human– decision-making 79 Figure 49: use 81 Figure 50: countries 82 Figure 51: 83 Figure 52: 87 Figure 53: 87 Figure 54: AI 88 Figure 55: 90 Figure 56: , employees 91 Figure 57: 92 Figure 58: 94 Figure 59: students 95 Figure 60: ’ students 95 © 2025 . Trust, AI: A 2025 | 3 © 2025 entities. . reserved. 2022 . , 2022.1 , OpenAI’s over 100 million months.2 global economy, , education, transport, manufacturing, agriculture, healthcare, retail, .3 and iteration, captures undeniable. than 48,000 47 countries, accurate, renewable regions. comprehensive energies, innovation workplace, cases.4 However, ’s AI. , a into apparent, the challenges, settings. trustworthiness, regulation, and . ’s AI expectations, challenges integration. . , a questions, — trust, use, , work, education, ; experience economy— benefits, in critical. society, education; expectations evidence- , regulation people’s trust, governments; how , AI, work . ; the . across a human-centered sub- , and . AI , , the developing, deploying, and AI. align Next, . © 2025 . Trust, AI: A 2025 | 4 © 2025 entities. . reserved.A (76%), regulation (69%), - industry (71%). remains a significant 87% fact- challenge: (54%) about -. . of , . five (58%) on a , with a , 72% use. . trusting (39% vs. 57%) (65% free, vs. 84%) . -. Emerging with 72% to three (66%) a 49% economies. can effectively. However, most (61%) work knowledge. AI. However, (80% vs 58%), workload, human training (50% vs 32%), knowledge (64% vs five 46%) (74% vs 51%) . Many economies. are inappropriate, complacent younger, university-educated, higher-income - work, AI- , . . training to adoption. benefits . efficiency, (83%, predominately accessibility, decision- innovation, tertiary) , cybersecurity, IP, efficiency, misinformation, , learning, . The stress. However, inappropriate, public's evident, non- by benefits widespread, about . over- thinking, collaboration, . has a AI policies, support regulation, with 70% is use. necessary. However, only 43% adequate. international © 2025 . Trust, AI: A 2025 | 5 © 2025 entities. . reserved. benefits, adoption: , employees risk intentionally5 on a , a . General- , , ways, increasing , raising employer. issues. , , organizational a company . information, financial, sales, Emerging economies6 , . AI, employees (72% vs 49%) ways. three . provides, they delivering a range AI. . , information, innovation, decisions, work abilities. AI- own. revenue-. highlight a AI, However, impacts , work. , stress, , compliance, . , , guidance, done, : , AI, advanced collaboration, offers AI- , and . , or a . of , tools, is a , . human-. by a , left ’t. From a , highlight a tools. place how , , transparency, engagement. © 2025 . Trust, AI: A 2025 | 6 © 2025 entities. . reserved. benefits, : over- trusting systems, advanced economies ( , trust students) a . (54%) systems. . pronounced. : in five (83%) in , daily. . , in free, , trust tools. . , trust education, . efficiency, information, work, safety, , security, stress. However, AI’s provide , , . explain . , a quarter , to a impact , interaction, . . systems, A students . , fairness AI. People’s emotions: , worry. widespread. AI inappropriately, , - AI. Two- , , , AI- government tools. so. have output. technology public interest, entities concerning: - . ’ themselves. they AI trustworthy . use: would A problem: place, , and , training, , ,"
KPMG_2025_AI_Trust.pdf,KPMG,2025,AI_Trust,1,"and . - . longer- skills— , collaboration, . © 2025 . Trust, AI: A 2025 | 7 © 2025 entities. . reserved. experiencing a both . landscape . People’s , is a : 42 , 32 : believe , required, majority 26 surveyed. . regulation many experiencing a broad benefits, efficiency safe , to AI. services, and personalization, - However, is outcomes, , expectations: in resources. , performance- adequate. , . . However, people’s society. regulatory about— . adaptive — (e.g. consumer . laws), connection, . , clarify, property, manipulation, , laws. dependency, , effective, fit-for-purpose . regulation— regulation— a of AI, . by a . expect a multipronged AI, , supported concern. a countries. National just ‘’ or a co-regulatory by a is the 47 self-regulation surveyed. regulator. public’s a impacts. a AI, as align . . © 2025 . Trust, AI: A 2025 | 8 © 2025 entities. . reserved. also a the AI-: limitations 87 harm. AI- a used safely, ethically, potential. - between -generated content. emerging a : emerging trust, . AI, higher , realized AI survey the , trust, public, students, and ; say . ’t or . higher for , despite 90 purposes, platforms. AI, about AI- use. training education. , AI, training, . effectively. by technology systems (e.g. using current ) use. , benefits, . overreliance of education. literacy. economies, - use .7 , six , advanced strongly economies, education pattern—India, China, a . Nigeria, , . economies, Norway, Israel, Singapore, as a cross-: , trust, acceptance, , trust, acceptance, and engagement, AI. in . AI only a , a strategic , © 2025 . Trust, AI: A 2025 | 9 © 2025 entities. . reserved. , a about . People’s the AI. willingness , countries. becomes a increased activity. exposure, general-purpose tools, , negative impacts (e.g. hallucinations), . and adoption: a AI ’s risks, view . For education; a , feeling a human- 2022 75% in people; 2024, outweigh from 71% to 44%. countries. AI, concern, of , a basis , , suggesting a interest. a . drivers, pathway remained , followed the . also . the AI, no governance, strategy, ’s self-reported . AI, . markedly since 2022, to a and ’s limitations, risks, need deployment . 17 late 2022, release . revealed a trend , Collectively, . evidence- the , work. These 17 countries: employee from , business, 34 71 percent, ’ AI government, at a , 54 67 percent. , policy , pan- Canada, , UK. . © 2025 . Trust, AI: A 2025 | 10 © 2025 entities. . reserved.Introduction - trust, attitudes, , regulation, as a industry practice. , , , attitudes, . how lives, work, , , , . , , relevance - evolving . of . the over 48,000 47 geographic regions, representative on age, gender, distribution. Taking a , AI in a research world. AI. designed independence, the from 17 late 2022, KPMG. focused ChatGPT. We ’ 2020, the attitudes scope 17 highlight in 2021, (see ‘ research’ in ). 17 2022. © 2025 . Trust, AI: A 2025 | 11 © 2025 entities. . reserved. three sections. ’s use, understanding, trust, and . , people: systems, healthcare, . , deeper . , and education. Together, -based questions: • ? • ? • the AI? • regulation ? • and society? • impacts? • with ? industry, government, . . © 2025 . Trust, AI: A 2025 | 12 © 2025 entities. . reserved. conducted 48,340 collected survey November 2024 -January 2025 using across 47 survey. jurisdictions, criteria: regions8: 1) ; 2) ,10 and 1. (Canada, United 3) .11 America [USA]) 1,001 to 1,098 respondents. 2. (Argentina, Brazil, Chile, Colombia, revealed a , Mexico) economies. the 3. Fund’s (IMF) classification (Austria, Belgium, Denmark, Estonia, economies. , France, Germany, Ireland, Argentina, Latvia, Lithuania, Netherlands, Brazil, Chile, China,12 Colombia, , Norway, Sweden, Switzerland, Egypt, Hungary, India, Mexico, Nigeria, Poland, [UK]) Romania, , , Türkiye, 4. (Greece, Italy, . Portugal, Slovenia, Spain) language(s) 5. (, Hungary, Poland, Romania, Slovakia) , . question countries, 6. Africa (Egypt, Nigeria, ) translated 7. (Israel, , , using Türkiye, Emirates [UAE]) . 1 8. Eastern, . (China,9 , India, Japan, Korea, Singapore) 9. Oceania (Australia, ) © 2025 . Trust, AI: A 2025 | 13 © 2025 entities. . reserved.The 47 Africa Spain Poland Türkiye Portugal Emirates Italy Kingdom United . America © 2025 . Trust, AI: A 2025 | 14 © 2025 entities. . reserved. ? levels, majority (72%) used incomes ( 1 the ).14 .13 Sixty- research. - part-time. and gender, Labor Organization15 statistics. countries, small, medium, organizations, ( 2 , self- ). employed (e.g. ). , students, with was 51 , 49 <1 . (65%) or a vocational, technical program (16%), secondary was 46 18 and 95 years. education (18%). sample (51%) had a and 20 percent a . , country sample, 2. Group 51% 49% <1% 12% 38% 32% 18% 18-24 25-44 45-64 65-95 Education 2% 4% 23% 20% 37% 14% Vocation/ Postgraduate 15% 72% 13% 52% 15% 28% working 67% Employees (n=32,352) Occupation 32% 22% 21% 14% 10% 1% Professional & Services & 77% 7% 16% 26% 32% 42% Self- (2-49 employees) (50-249 employees) (250+ employees) 5% Students (n=2,499) Program 18% 16% 54% 11% 1% ’s © 2025 . Trust, AI: A 2025 | 15 © 2025 entities. . reserved. , ): (used a ); ( inform respondents’ AI, treat AI, patients); AI ( inform definition,16 : promotion); (AI) machine- general. objectives provided, represent predictions, content, recommendations, decisions. , adaptiveness. input. Respondents with a them, , that systems. society (randomly AI A to , diagnosis images, audio, a job, (e.g. cancer), . , health in a job, . data. a patient’s (e.g. , scan data. , , , a data, history, age, weight , time, gender, etc.) writing, programming, . education, retention. inform support, patient , treatment. forecasting, promotion. music. © 2025 . Trust, AI: A 2025 | 16 © 2025 entities. . reserved. analyzed"
KPMG_2025_AI_Trust.pdf,KPMG,2025,AI_Trust,2,"economic groups (e.g. , IMF), factors (e.g. gender, age, education, income, occupation). Relevant statistically meaningful. associations causality. are Appendix 1. shown 3. , attitudes , use, , a selection in the 2022 and 2024 surveys. The 2022 17 countries: Australia, Brazil, Canada, China, Estonia, Finland, France, Germany, India, Israel, Japan, Netherlands, Singapore, , Korea, , USA.17 in 2022 and 2024 representativeness, each other. , than a . call-out ( overview, 4). © 2025 . Trust, AI: A 2025 | 17 © 2025 entities. . reserved. , ’s , acceptance, . people’s systems, risks, governance. a in AI. © 2025 . Trust, AI: A 2025 | 18 © 2025 entities. . reserved. ? public levels, ’s . , self- AI- . AI. , employees’ ’ AI detail, together . : the —particularly personal, general- —can by a work, purposes to a of . other tools, AI (e.g. individuals. engines). 38% (66%) report a , work, reasons. As Figure 1, five (38%) people a , over a quarter (28%) report semi-regularly (i.e. ). One-third (34%) on a weekly . basis. five (59%) semi- , (only 37%). five (58%) people for , (83%) studies. © 2025 . Trust, AI: A 2025 | 19 © 2025 entities. . reserved.Figure 1: personal, work, purposes ‘ (work/studies), , ?' % use 21 20 17 15 14 13 a Daily = ‘’ or ‘ a day’ Figure 2, people’s AI, 70 the , - (92%). Two a between — emerging Romania— economies, notably economies. . , , five (80%) emerging below 70 , a regular -, five (43%) Singapore (73%). (58%) economies. © 2025 . Trust, AI: A 2025 | 20 © 2025 entities. . reserved.Figure 2: countries % % Overall India 9922 Nigeria 9922 Emirates 9911 Egypt 9900 China 8899 8888 8877 8833 Brazil 8822 Türkiye 8811 Mexico 7777 Argentina 7755 Colombia 7744 Singapore 7733 Chile 7722 Latvia 7722 Norway 7711 Estonia 7700 Lithuania 6699 Poland 6699 Israel 6688 Slovenia 6666 Switzerland 6655 Portugal 6633 Romania 6622 Greece 6611 Korea 6611 Italy 6600 Spain 6600 Denmark 5577 Ireland 5566 Finland 5555 Austria 5533 5533 5533 5522 France 5511 Germany 5511 Australia 5500 Canada 5500 Hungary 5500 Japan 5500 5500 4499 Sweden 4499 % on a semi-regular Belgium 4477 basis: ' months’, ‘monthly’, ‘weekly’ Netherlands 4433 or ‘daily’ © 2025 . Trust, AI: A 2025 | 21 © 2025 entities. . reserved. Figure 3: AI- don’t , yet 3 in 5 % 39 % training adoption, of of . (39%) 61 , work- training, training work, a university-level Figure 4: Self- knowledge ( analytics; 3). ‘ you... (a) AI? training, (b) used? (48%) knowledge (c) ? , they (d) used.18 appropriately?’ 4, people 21 knowledge, a % Low a . % Moderate 48 % High 31 % Low = ' all' or 'To a ’ % High = ‘To a ' or 'To a extent' , a broad knowledge, 60 (via a application, . example, choose, ), , training. , AI ( 5). conversing tools. Figure 5: Self- efficacy ‘ following? I can…’ % Disagree % Neutral % Agree overall 21 19 60 work 21 17 62 applications 21 19 60 for a task 23 18 59 24 21 55 % Disagree = '', 'Disagree', '' % Agree = '', 'Agree', '' © 2025 . Trust, AI: A 2025 | 22 © 2025 entities. . reserved., knowledge, 7, , knowledge, Nigeria, Egypt, , India, . use groups, also use ( 2). , and and , Japan. , knowledge, . 6, surveyed AI- , compared than a . Similarly, - emerging , advanced economies. - the effectively, in . Figure 6: , groups % Global % % 74 64 60 52 51 50 46 39 32 © 2025 . Trust, AI: A 2025 | 23 © 2025 entities. . reserved.Figure 7: , efficacy, 20% 25% 30% 35% 40% 45% 50% 55% 60% 65% 70% 75% 80% 85% Nigeria Egypt Emirates India China Colombia Lithuania Argentina Brazil Mexico Estonia Switzerland Singapore Slovenia Chile Norway Israel Spain Latvia Korea Greece Türkiye Italy Denmark Romania Portugal Ireland Finland Poland Austria USA Sweden Netherlands France Canada Belgium Australia Japan Germany Hungary % = ‘% To a ’, ‘% To a ’, ‘% To a extent’ % = ‘% ’, ‘% Agree’, ‘% ’ % = ‘% ’, ‘% -’, or ‘% work’ . . © 2025 . Trust, AI: A 2025 | 24 © 2025 entities. . reserved.A majority (90%) : , (47%) AI’s . in don’t media Figure 8, people’s for use, , — 8, AI’s (i.e. engage function). Seventy- . -— likely ’s lives— a third (36%) are countries (70% vs. . 61%), these AI- (88% vs. 74%). . , Figure 8: ‘ , ’ % AI % 36 Overall 79 47 90 Virtual 22 assistants 77 Facial 38 recognition 69 Self- still media since 2022, self- (M=2.6 in 2022; M=2.6 in 2024). However, , Estonia, Brazil, , (26% vs. 50%, M=2.1 vs. 2.8) (38% vs. 63%, M=2.5 vs. 3.0). media, , countries, that function. , and countries (88% points), platforms (2022: 44% vs. 2024: 46%). © 2025 . Trust, AI: A 2025 | 25 © 2025 entities. . reserved. tend AI, emerging economies AI (r=.48), suggesting a where (83%) AI, (97%) (59%) . . , those , over 90 percent fall express a about . AI. , economies (Australia, , , Canada, , Finland) interest ( 59- e9cono0mies,% over 67%), . Australia low, (41%) in . express a desire AI , public, . Low people’s capabilities benefits, , the , their outputs, . , manipulation. . increasingly in .19 , more trusting, accepting, , . © 2025 . Trust, AI: A 2025 | 26 © 2025 entities. . reserved. ? , and a , perceive . feel . trust: a (e.g. by ) ( accuracy, helpfulness, ).20 technical the a helpful . its : safety, people , systems (r=.70) AI (r=.48). society. . , 58 AI trustworthy.21 measured (65%) , security, people, , about soundness (e.g. , components: AI"
KPMG_2025_AI_Trust.pdf,KPMG,2025,AI_Trust,3,"harm, ; 52%). (e.g. and a , ), use (e.g. to 9. , —a sound). —half people systems: Reliance a , a that ’s . By system’s output, a recommendation contrast, — (i.e. ). trustworthy—83 are provide a , while 72 system . (e.g. a service). © 2025 . Trust, AI: A 2025 | 27 © 2025 entities. . reserved.Figure 9: systems use 35% 40% 45% 50% 55% 60% 65% 70% 75% 80% 85% 90% Nigeria India China Egypt Türkiye Emirates Brazil Mexico Singapore Romania Chile Colombia Spain Norway Hungary Lithuania Latvia Argentina Italy Korea Switzerland Poland Estonia Portugal Slovenia Greece Israel Japan Ireland Denmark USA Belgium Austria Germany France Australia Canada Sweden Netherlands Finland % Agree = '', 'Agree', ''. . . © 2025 . Trust, AI: A 2025 | 28 © 2025 entities. . reserved. benefit , combined AI a little .22 (54%) people’s is , an trust ( 10). Only 46 systems. . ’s acceptance AI, (see cases. 10, Figure 10), , a Resources, general use. , a (42-45% , Ms=3.9-4.0). . , (72%) healthcare (52% willing, M=4.3), . in 42 47 ( 11). Figure 10: ‘ AI []?’ % trust % Ambivalent % trust 35 19 46 general 36 19 45 37 19 44 AI 39 19 42 30 18 52 % trust = '', 'Unwilling', or '' % Ambivalent = ' ' % trust = '', 'Willing', or '' ‘ / AI []?’ % %Moderate % Acceptance 28 39 33 % = ' all' or 'Slightly' % = 'Highly' or 'Completely' © 2025 . Trust, AI: A 2025 | 29 © 2025 entities. . reserved.Figure 11: 20% 25% 30% 35% 40% 45% 50% 55% 60% 65% 70% 75% 80% Nigeria India Egypt China Emirates Türkiye Brazil Hungary Norway Spain Israel Mexico Singapore Latvia Switzerland Greece Estonia Argentina Romania Colombia Chile Korea Denmark Poland USA Italy Austria Slovenia Ireland Portugal Sweden Australia Belgium Lithuania Canada Netherlands France Germany Japan Finland % on ‘’, ’’ and ‘’. % Willing. . © 2025 . Trust, AI: A 2025 | 30 © 2025 entities. . reserved. 41 79 Nigeria). Nigeria, India, Egypt, 12, China, , Arabia— advanced 60 at economies. least 49 . economies, levels and , reported. systems. , - , in 25 . 29 . advanced economies, Norway,23 Spain, , have Israel, ( 50 systems, ). , the trustworthy, trust (25-28%) use. notable, however, Australia (15-17% ) that 43 . AI systems, emerging . uptake countries.24 , 13, people in 12 17 ( Figure 12: groups % Global % % 84 72 69 65 57 58 52 46 39 AI Trust = % '', '', '' Trustworthy = % '', 'Agree', '' trustworthy Acceptance = % 'Moderately', 'Highly', 'Completely' accept © 2025 . Trust, AI: A 2025 | 31 © 2025 entities. . reserved.Figure 13: % Trust % 79 Nigeria 66 76 India 63 71 Egypt 61 68 China 69 65 Emirates 54 62 52 62 49 56 Türkiye 44 55 Brazil 44 54 Norway 43 54 Hungary 29 52 43 51 Spain 32 51 Mexico 38 51 Israel 38 50 Singapore 31 47 Latvia 36 47 Estonia 34 46 Switzerland 36 46 Greece 27 46 Argentina 35 45 Romania 36 45 Colombia 32 45 Chile 33 44 Korea 28 42 22 41 USA 21 41 Poland 30 41 Denmark 33 40 Slovenia 28 40 Italy 30 40 Austria 26 38 Ireland 20 36 Sweden 22 36 25 36 Portugal 24 36 Australia 17 35 Belgium 21 34 15 34 Lithuania 35 34 Canada 19 33 Netherlands 18 33 France 24 32 Germany 29 31 22 28 Japan 18 25 Finland 20 % Trust = ‘’, ‘’ or ‘’ % = 'Highly' or 'Completely’ . © 2025 . Trust, AI: A 2025 | 32 © 2025 entities. . reserved. : sentiment. , 74-82 people. a AI (56%) . applications. 14, , worried— , feel demonstrating a . equal measure (61-64%), (51%) . and a clear negative Figure 14: ' [], …' % Global % % 82 74 68 64 61 61 60 56 51 Excited on a 5-, displaying % High = ‘Moderately’, ‘Very’ or ‘Extremely’ pattern, Figure 15 excited. , over 80 people AI level. applications, 43 worried. , whereas , . , 70 optimism only 37 percent countries. © 2025 . Trust, AI: A 2025 | 33 © 2025 entities. . reserved.Figure 15: countries % Optimistic % Worried % Excited 35% 40% 45% 50% 55% 60% 65% 70% 75% 80% 85% 90% India China Nigeria Türkiye Egypt Emirates Brazil Romania Lithuania Latvia Norway Chile Mexico Colombia Israel Argentina Poland Singapore Slovenia Estonia Korea Spain Hungary Switzerland Italy Greece Portugal Germany France Denmark Austria Ireland Belgium Sweden USA Canada Japan Finland Netherlands Australia % : % Moderately, % % Extremely. % optimistic. . © 2025 . Trust, AI: A 2025 | 34 © 2025 entities. . reserved. , , prompting a . 63 people 2022 , a to 56 2024 (M=4.8 vs. M=4.6; 16). , (49%) of 2022 to 62 2024 (M=2.4 M=3.0). in 15 output, safe, use. 17 countries, 13 (49% in 2022 vs. 75% in 2024) 17 countries, Israel, Estonia, (68% to 52%) Africa (76% vs. 62%). ( 21-26% worry). Similarly, people’s 11 17 countries, from 52 systems, largest in 2022 to 43 2024 (M=4.3 vs. France, 35 M=4.0; 16), in 12 in 2024 (M=2.0) the 17 countries. 58 2022 (M=2.6). country (43% to 21%) (67% to 53%). Korea, where 75 in 2024, compared to 57 2022 (M=3.2 vs. M=2.5). Figure 16: and % 2022 and 2024 % trustworthy % 80% 70% 63% 62% 60% 52% 56% 50% 49% 43% 40% 30% 20% 10% 0% 2022 2024 = '', 'Willing', or '' systems = aggregate '', 'Agree', or '' = ‘moderately’, ‘very’, ‘extremely’ © 2025 . Trust, AI: A 2025 | 35 © 2025 entities. . reserved. Overall, society, are their society, to provide a . AI, , worry, . Moreover, time, . section systems. © 2025 . Trust, AI: A 2025 | 36"
