report,firm,year,industry,chunk_id,text
KPMG_2025_AI_Trust.pdf,KPMG,2025,AI_Trust,8,"work 39 19 42 - own 45 16 39 28 21 51 34 24 42 44 25 31 % = ‘Sometimes’, ‘Often’, or ‘’ Figure 45: ‘ work, …’ % Never % sometimes % Overall 5 47 48 it 4 40 56 6 46 48 's making 4 48 48 output 5 48 47 using 7 51 42 AI- % sometimes = 'Rarely', 'Sometimes' % = ' ', 'Always’ reflect a output, or AI. content. Most 45, , work. Rather, the them. © 2025 . Trust, AI: A 2025 | 76 © 2025 entities. . reserved. work? impact AI, workload, stress, increase. Furthermore, report collaboration, compliance, and outcomes. use surveillance a factors, impacted a work, outcomes. a , and , , , employees’ capabilities. . is impacts, workload, 46 ( bars), a tasks, at employees (54-67%) work ( 46). five a (36-40%) , reductions, - two- information, fifths (26-39%) , generation, repetition, decision-making, . evidence abilities, result . work, (46%) change . management.43 significant . However, (r=.24), knowledge (r=.42), efficacy . A a third (r=.41), (r=.56) outcomes. , a work. © 2025 . Trust, AI: A 2025 | 77 © 2025 entities. . reserved. . implications collaboration. workplace: , required collaboration, a it. governance policies, contribute A third (35%) of employees.44 , , policies laws. , tools, security , , . . the privacy understanding, risks, for implementation, impacts threats , with redesign, to . human- . AI Figure 46: employees ' experience, impacted:' %Reduced/ % % Increased/ work 9 24 67 10 29 61 12 29 59 decisions 10 32 58 abilities 13 32 55 13 33 54 activity 10 44 46 people 19 39 42 17 46 37 %Reduced/ % % Increased/ Workload 40 34 26 36 25 39 work 36 38 26 19 46 35 (e.g., ) employees 13 45 42 % Reduced = ‘’, ‘Reduced’, or ‘’ % Increased = ‘’, ‘Increased’, or ‘’ © 2025 . Trust, AI: A 2025 | 78 © 2025 entities. . reserved. dominate decision-making, fewer support a - is involvement. of human- - . , employees cannot AI ( Figure 47: 47). ‘ work, …’ learning . % Never %Rarely % employee do a yourself AI 28 23 49 negative . others focus 30 22 48 -skilled, . 34 23 43 , peers . achieving a % = ‘Sometimes’, ‘Often’, or ‘’ inputs, workplace. about 48: human–AI ( Figure 20). decision-making ‘ most -?’ decision- ’ % selected human- -making. 45 most decision- allocation, hiring, promotions, and 29 .45 48, -making, but 14 . 10 consider a 75 and 2 25 decision- the balance. AI 50/50 split, 100% 75%, 50%, 25%, 100% a respondents. AI 25% AI 50% AI 75% © 2025 . Trust, AI: A 2025 | 79 © 2025 entities. . reserved. and O5nly 5% adoption, advanced economies importance use. organizations AI, whether : a) , within b) ensure employees, and c) use. place, systems, , . economies ( 49). economies, unlderf , including a culture adoption, adequate , processes. Only 55 adequate use. AI support mechanisms, . . , economies, about 70 has a clear , , and 65 policies. Furthermore, 71 use. training, , . . organizational . © 2025 . Trust, AI: A 2025 | 80 © 2025 entities. . reserved.Figure 49: use ‘ organization, following?’ % economies % economies 56 overall 72 59 73 52 strategy 68 58 recognized 74 54 73 55 overall 73 56 systems 74 56 75 57 74 AI 52 70 54 70 govern 50 AI 65 50 them 67 ensure 52 71 62 people’s data 75 55 ’s AI 72 % Agree = ‘’, ‘Agree’, ‘’. AI. Country- UK, Norway, Italy, lead, differences ( 50). least 60 robust . , employees Over 70 India, , Slovenia, Republic, and Nigeria, Egypt, China, , , Türkiye, , . AI. Among , Singapore, Switzerland, © 2025 . Trust, AI: A 2025 | 81 © 2025 entities. . reserved.Figure 50: countries % % % governance 40% 45% 50% 55% 60% 65% 70% 75% 80% 85% 90% India Nigeria Egypt China Emirates Türkiye Brazil Singapore Switzerland Mexico Colombia Norway Italy Denmark USA Argentina Chile Romania Estonia Australia Poland Ireland Hungary Canada Belgium Spain Latvia Sweden France Lithuania Japan Germany Austria Greece Israel Netherlands Korea Finland Slovenia Portugal % Agree = ‘’, ‘Agree’ and ‘’; [7 ]. AI. . © 2025 . Trust, AI: A 2025 | 82 © 2025 entities. . reserved.AI’s jobs: AI a AI- insecurity. impact optimistic ( 51). AI, with 39 percent will . eliminate, 23 impacts, a . optimism. eliminate. more Rather, opposite—that create. performed earlier- that (53% vs. 35%), (64% vs. 48%), are a is ’t .46 (56% vs. 42%). and work, and, importantly, work. tools. , , . Figure 51: ‘ following?’ % Disagree % Neutral % Agree I AI 28 18 54 41 16 43 work 43 17 40 eliminate 48 23 29 % Disagree = ‘’, ‘Disagree’, or ‘’ % Agree = ‘’, ‘Agree’, or ‘’ © 2025 . Trust, AI: A 2025 | 83 © 2025 entities. . reserved. four work? earlier: (knowledge pathway), work (motivation), a complex (uncertainty), realize AI, , , encouraging (). Additionally, of thoughtful, examined. use. in achieved, . the , AI, ‘ drivers . systems?’ employees’ critical AI • (B=.46) • form • (B=.41) , culture, of (B=.23) • (B=-.24; engagement, • reduce work (B=.09) employees’ ) • • (B=-.09; work (B=.21) ) • (B=.05) • governance47 (B=.11) • work, • work , (B=.06; become pressure, risks (B=-.05; in ) ) , is a , tools. Instead, employees engagement. based technology’s reliability. . AI- can , employees frequently, a stance. tools. the adoption, . © 2025 . Trust, AI: A 2025 | 84 © 2025 entities. . reserved. influence work? use, trust, , . toward work. , , , university-educated, higher- AI benefits (). Conversely, believe —, lower-income work employees, 52, (— under 35), , university- ‘’ in education, incomes, progression, benefits. High-, AI . are , AI-, work ."
KPMG_2025_AI_Trust.pdf,KPMG,2025,AI_Trust,9,"53, higher-, , . experiencing - -, employees -managerial literacy, ( 33-35). occupations. impacts, high- work (67% vs. 43% (72%) middle- (54%) - ; 62% vs. 44% (44%). education; 41% . 21%-29% ). (76% vs. 56% high- ; 75% vs. 55-67% occupations) revenue-generating eliminate (65% . 36-56% (55% vs. 34% training; occupations; 54% high-. 26% and 59% 40-43% 17% - -, occupations). respectively). © 2025 . Trust, AI: A 2025 | 85 © 2025 entities. . reserved., IT, finance , , and the in administration inappropriately. 18 Figure 54.50 analyses,48 , of training, - from 527 employees 3,415 employees . . , 53, 65 younger indicative employees ( 35) in trends. behaviors, significant ([] n²=.04).49 Similarly, a indicators, : (63% vs. • Technology (IT), 46%; n²=.03), Communications, and (53% vs. 40% ; n²=.03). (72-85%, 54) plays a role, - AI (90-94%). earners (70%) • and use. Notably, they (75-76%), trust groups work (62-67%), beneficial (n²=.03). (63-66%), impacts (68-72%). , • , and , Social . Assistance, sectors , workplace AI norms, , systems (43-47%), (61-63%), used. , may responsible AI use (55-60%), impacts established, (48-52%). complacent norms. • , over- Social in groups. , (46-48%) . work (33-35% agree). • in analyses, industries. © 2025 . Trust, AI: A 2025 | 86 © 2025 entities. . reserved.Figure 52: % % work Age 72 18–34 57 56 35–54 52 40 55 44 Income 83 High 72 56 Middle 50 34 Low 82 64 36 training 41 Education 68 58 44 education 44 Occupation 77 Manager 65 62 skilled 53 52 Clerical, sales 48 34 Manual 41 % work = '', '', '' % = ‘Occasionally ( months)’ to ‘Always ( a day)’ Figure 53: % impacts % Income 72 High 70 54 Middle 53 45 Low 47 65 63 45 training 46 Occupation 67 Manager 62 56 Skilled 54 52 Clerical, Service, 54 49 Manual 55 Age 18–34 65 35–54 53 55 41 % = ‘Rarely', ‘Sometimes’, ‘Often’, and ‘’ % impacts = ‘', 'Increased', '' © 2025 . Trust, AI: A 2025 | 87 © 2025 entities. . reserved.Figure 54: AI % Industry % 85 76 75 Communications 67 72 75 Power, Energy, Utilities, 66 66 66 65 65 Training 59 64 Activities 65 59 Arts, 58 59 61 58 Construction 65 54 61 54 Agriculture, Fishing 61 54 Manufacturing 66 51 61 47 Transport, Logistics, Postal 60 46 60 45 Assistance 58 Government, , 43 55 Defense, % = ‘Occasionally ( months)’ to ‘Always ( a day)’ % = ‘’, ‘Agree’, ‘’ , reveal a . A AI , , and . However, integration, workload, stress, . are complacent, lagging, . , the , tools use, substantial . -making, -. section, future. © 2025 . Trust, AI: A 2025 | 88 © 2025 entities. . reserved. in education the studies, use, , and education. education (65%) or a vocational, (16%), with education (18%; 2 details). © 2025 . Trust, AI: A 2025 | 89 © 2025 entities. . reserved. students? Collectively, . (83%) studies on a , their daily. Eighty- studies (8%, n=195), personal, non-study- AI -regularly. (55%), (34%), their have a learning (31%). work (83% vs. 58% semi-regularly; -purpose Figure 55). (53%) students , employees, students (52% trust). -purpose half (53%) (89%) -based training, 72 assistants (42%) studies, (see 56), use effectively. free, tools (89%) provider (26%), or (12%). Figure 55: ' studies/work, , ?' % Student % Employee 40 35 30 25 27 25 26 20 15 18 17 15 15 10 14 14 12 5 8 9 0 Never A Daily a Daily = ‘’ or ‘ a day’ © 2025 . Trust, AI: A 2025 | 90 © 2025 entities. . reserved. over-reliant , for (52%) their learning. relied a , how , complete it, the help ( 57). Eighty- . Rather, can , - in ( 57). AI. (59%) be a ’s guidance. , of (56%) being inappropriate, don’t . and 84 increased AI, potentially . . inappropriate non-, over- , work. example, quarters (76%) of coursework, AI- own. AI (77%), compared thirds (66%) . Figure 56: , employees ' study? ' % Study General- 89 (e.g., ChatGPT, Copilot, Claude) Voice- assistants (e.g., Siri, Alexa, 42 ) Image / video / 28 (e.g., DAL-E, Canva) Specific- 25 (e.g., Grammarly, Github) customized 13 provider - tools (e.g., for 9 , ) systems 6 (e.g., ) © 2025 . Trust, AI: A 2025 | 91 © 2025 entities. . reserved.Figure 57: 'As a student, ...' % Never % Rarely % Overall 27 21 52 guidelines 41 20 39 a tool 47 17 36 16 16 68 whether 27 19 54 allowed 44 23 33 Non- ' work 25 19 56 - own 36 19 45 knowing AI 19 21 60 evaluating 24 27 49 35 26 39 Overreliance a lecturer 11 14 75 19 24 57 others 23 22 55 23 24 53 % = ‘Sometimes’ or ‘Often’ or ‘’ © 2025 . Trust, AI: A 2025 | 92 © 2025 entities. . reserved. education? , interaction, and education, ’s , trust dynamics, , , assessments, had a Figure 58 . impacts education. a , , pressure. a and a a , impacts. tasks. figure ( bars), advantages— completing — key , , , , fairness work, , . learning. Students’ . mirror However, impacts. A employees. one to a students (27-36%) , eliminate, . © 2025 . Trust, AI: A 2025 | 93 © 2025 entities. . reserved.Figure 58: ‘ experience, impacted:’ % Reduced/ % % Increased/ work 14 17 69 17 24 59 work 20 24 56 22 22 56 learning 20 29 51 abilities 24 26 50 36 27 37 work 27 37 36 Communication, interaction, with 32 38 30 teachers/ peers students 34 36 30 % Reduced/ % % Increased/ Workload 55 23 22 pressure 53 27 20 tasks 49 18 33 % Reduced = ‘’, ‘Reduced’, or ‘’ % Increased = ‘’, ‘Increased’, or ‘’ impacts. : . , has a"
KPMG_2025_AI_Trust.pdf,KPMG,2025,AI_Trust,10,"than a that a , only surveyed (49%) students, use ( use 60). A is . a place, suggesting a awareness use. to - assessment and ( 59). policy, resources. provider © 2025 . Trust, AI: A 2025 | 94 © 2025 entities. . reserved.Figure 59: students ‘ , following?’ % Disagree % Neutral % Agree responsible 35 19 46 assessment resources 33 17 50 responsibly 26 16 58 systems 25 18 57 systems to 33 18 49 differently to 30 19 51 learning % Disagree = ‘’, ‘Disagree’, or ‘’ % Agree = ‘’, ‘Agree’, or ‘’ Figure 60: ’ students ‘ place a ?’ 31 24 % GenAI % No % % Don't know 27 18 AI, widespread, and . Furthermore, education training, students. skills age, work, future. broader . © 2025 . Trust, AI: A 2025 | 95 © 2025 entities. . reserved. implications opportunities , education, . its use. Although a , utility, , , . trust, risks.51 its . levels: • , from challenges, treatment. to advantage.52 • AI, , fraud, , bias, - . • , , innovation, AI, trust. • , efficiency, creativity , deskilling, human connection. , them behind. levels. , training, governance, challenge, . a public adoption, integration, , its regulation. . , citizens; , employees; time53 . © 2025 . Trust, AI: A 2025 | 96 © 2025 entities. . reserved. , use, which uncertainty. trust, whether A in with . literacy, as adoption realize and a , acceptance, and . . self- , , society, - and use.54 becomes a central , China, Nigeria, productivity, innovation, . challenges, . advantage, the security, technologies these relations, to countries55 or economies.56 , may . a , limited. acceptance a deficit. can based society, the . , language, skills, information it, , may literacy. Well- to seize a benefits, limitations, . opportunities, markets. a acceptance , acceptance, as a progress, negative prosperity, . , deploying as a . (e.g. design), strengthening of , , , literacy, . programs, . literacy (), benefits (motivational), trust economies optimism: responsibly (institutional) experience () a to risks. . Rather, they benefits, why . However, guard workplace that work, from engagement, . use, levels © 2025 . Trust, AI: A 2025 | 97 © 2025 entities. . reserved. is a play a . expect economies, , with - , regulation, . cultural, political, contexts, don’t into - . a cross- regulatory border, a expectations: policymakers . International The 47 represent a (e.g. Organization [ISO]) governments governance. governance. , as expectations, implemented. , safe. Korea, had the reflects of and implementation. , . also India, - existing frameworks. Similarly, a range exist. — economies , Türkiye, UAE— gap, policymakers design, enforce legislation. regulation, USA ( ) laws. This a how approach. Notably, (e.g. ) collection, , , 58 agreement, , .57 laws.58 , of a globally have approach, a applications (e.g. chatbots). regulatory AI. , considerably a robust, fit- , for- AI, public use. . A a approach, adoption, regulation, countries. © 2025 . Trust, AI: A 2025 | 98 © 2025 entities. . reserved. AI-generated a globally59 regulators . There • regulation measures . AI-, media • fact- and - level. (e.g. watermarking). These by • experts fact- .60 enforceable. • ’s standards, interoperability, supporting risks. well- . • , AI. disseminate, . • : . • - and disinformation. , self-reported , and a human- • fact- other . - and disinformation. clear performance- • and , utilization, AI-generated content. , enhanced , revenue-. leakage, IP, technology. concerns. , a are However, these contravene often rules, a of risk, . complacent, inappropriate, -transparent employees’ work employees, and , risks. leaders, alike. Compounding use.61 with AI62, , a , , preparedness. imperative . © 2025 . Trust, AI: A 2025 | 99 © 2025 entities. . reserved. support adoption, -. more , , a culture, upskilling. employees mechanisms, — older training, understanding and capabilities, education— of . : the ‘’: to a offers. strategic, cultural, training place. mixed , organizations workload, , deskilling, and . , enhances Standards.63 encouraging , wellbeing, work. , oversight, foster a sustainable – , strategic that job use. security, . use. clear A strengthen guidance, policy, training, , and also a and stakeholders, investing work. use. indicates systems support a , , such experimentation, , and over- (e.g. recommendations, , ), standards, . third- assurance. , , , , products .64 , of ( levels ), .65 goals. complement Rather, work. , Specifically, a organizations system, appropriateness hand. training create into , — processes, , . reviews— workplace © 2025 . Trust, AI: A 2025 | 100 © 2025 entities. . reserved. leaders: : • human-AI • clear , , . AI. • , • , oversight, accountability, , needed. transparency, management. • management while • into -making. policies. • employees: use. • AI • . , , honest • , AI strengths, deployment. limitations, for • tools. and • validate . work. • Understand, manage, the • policies followed. . • • , , , , use. use. -: are , profound. students, tasks, of , , , frequent, —all general- . . from , students— efficiency, future— tech- , , more well- capabilities, , workloads , . However, skills, and cognitive, social-relational, impacts, . complacent AI. © 2025 . Trust, AI: A 2025 | 101 © 2025 entities. . reserved. providers, emphasize providers: frameworks, programs • students’ with . . , , • that integrate, , human- skills, uniquely students’ long-. collaboration, teamwork, , and , . models, suggesting a • preserve . -, while • ensure capabilities. for a work. a , ensuring - : proficiency, human • ethically, , innovation, transparently, collaboration, decision-making. . a . • systems Instead, question, work, limitations, and verify, is a . work. Ultimately, leaves • as a , not reimagine a shortcut: develop a paradigm. , capabilities. in- interpersonal assessment , process- (e.g. , in-class a problem-) - concern. experienced human-.Fostering a"
KPMG_2025_AI_Trust.pdf,KPMG,2025,AI_Trust,11,"people, and — than than a developing , , capabilities—will connectivity crucial. AI-, environments, . . pose a to — training, governance, solutions. It — and , purpose, and responsibilities. and , a AI-empowered programs. . © 2025 . Trust, AI: A 2025 | 102 © 2025 entities. . reserved. root , requires a technical, social, employees, a organizational, regulatory, actions, a , . the performance, . less fix: , outcomes (i.e. ; a third) human-. , is a to . have a shared effectively, responsibly, by a 47 countries, . ‘potential’ risks: by impacts. of , , international it. reinforce . , norms, governance, positive development. A cross- impacts approach— and , . Our providers, leaders, — of , effectiveness, innovation, -capable, AI-wise. savings, human connection, privacy, mis- , Re- AI-: dependency. fully long-, underscoring requires a every ’s stem . : (e.g. bias, , ), individuals (e.g. , , AI’s ), , a -enabled (e.g. dependency, of interaction, IP).66 communities . © 2025 . Trust, AI: A 2025 | 103 © 2025 entities. . reserved.Appendix 1: section, c and d survey or and ‘ ’. Respondents applications, , each. these questions, a procedure , used for, works ( page 16). team a Research. in- experts , , and AI. ’s: a) ; refined b) AI; c) systems (, acceptance, reliability.67 survey risks, benefits, emotions); d) countries, , back- management; e) attitudes, (s) work ( working) country, ( studying). . also , preferred. asked a open-. research, , .68 OECD ( insufficient page 16), a . understanding: . “ a text, images, straight- videos, buy, (e.g. , photos, disease, items), -, or self-.” . © 2025 . Trust, AI: A 2025 | 104 © 2025 entities. . reserved. Specifically, : “ which , existing income ( wages, salaries, research sources).” provided (e.g. al., 2021; Harmon- on a 1-10 scale, where 1 = group, al., 2016; al., 2002, 2011; Lee & 5 = group, and 10 = Park, 2023; al., 2023; Zhang & Moffat, group. also a ‘ ’ option. 2015) (e.g. Ipsos, 2017; Zhang & Dafoe, 2019). either a 5 or 7-point (e.g., was (1) agree (7)). a reliable 7- adapted - were (2012) prior . surveys. are: “ reliability, to… content from .81 (critical system” ( rely); AI) to .96 ( “ AI). a you” ( ); , “ systems” (). Perceived a 9-item interpretation, system, al. means. (2002). include “I to 100 percent : accurate” rounding, value (ability); “ ” ( values’ decimal ). part, . provided a indicators. ‘don’t know’ option. When 5 items , it Ipsos (2017) people’s percentages. than is 5 percent, used, , feel percentages , data. . with a 6- (Lee & examine Park, 2023; al., 2023). . - p<.001. effectively (e.g. “I can… relationships. data activities”) - self-reported, causality responsibly (e.g. “Identify use . applications”). people’s between-country, between- application, between- within-person applications (, , for ) (yes, don't know). - - sizes (, 1988; Lakens, 2013). a (WVS; ., 2022). © 2025 . Trust, AI: A 2025 | 105 © 2025 entities. . reserved. one- (ANOVA) the 17 countries, 2022 and 2024 (e.g. use differences). applications: general, , and AI. , comparative . First, a AI - p<.001 . significance. 2024. Additionally, some , between 2022 and - size 2024, removed. measures, groups. size, surveys.71 significance; thus, findings .03 on , changes meaningful. . differences.69 differences (p<.001) 4 paired-sample t- . within- (, (e.g. n² ≥ .03) cross- use). highlighted, a cross- . Specifically, Hedges’ g with a cut- -. .30 a practically .70 © 2025 . Trust, AI: A 2025 | 106 © 2025 entities. . reserved.Appendix 2: non- , sample , , within a differences 5 , . differences . exceptions economies—and below. countries— , , 51 , 49 and <1 covariance (MANCOVA) tests. genders, Rica, Latvia, change; differences, significant (54%) (32%). and age. 46 not 35 years ( Arabia) to 53 years (Japan). reaching . over-65-year- : China (over 65s expected: 17%, achieved: 10%), Egypt (expected: profile 9%, achieved: 5%), Greece (expected: 27%, Sixty- were achieved: 16%), Israel (expected: 18%, achieved: employed (52% full-time; 15% part-time), yielding 11%), Lithuania (expected: 25%, achieved: 14%), 32,352 Portugal (expected: 27%, achieved: 17%), Slovenia . (expected: 27%, achieved: 11%), and Türkiye 50 percent (Belgium, Finland) to (expected: 13%, achieved: 7%). 89 percent (UAE). , 53 percent China, Egypt, more and 47 , with a mean population. unable 41 (range = 18-95). employed and organization (77%), self- Slovenia. include employment (16%) ownership (7%). industries . (e.g. utilities = 2%, manufacturing = 11%) (e.g. sales = levels. 10%, skilled = 32%). respective profile economies, country university- 5% sample (n = 2,499), with 56 and 44 . populations ( was 23 (range = 18-86), with 65% OECD 2024 as a comparison72). university, 18% education, countries 16% , trade, programs, educated, and 1% education. Student urban, younger, , countries (range = .73 28 [Switzerland] to 115 [Nigeria]). Country- , . © 2025 . Trust, AI: A 2025 | 107 © 2025 entities. . reserved.Table A2-1: sample COUNTRY % (YRS) % % EDUCATION W M O Mean 18-24 25-44 45-64 65+ < PG ARGENTINA 51 49 <1 43 17 41 28 14 4 33 25 34 4 AUSTRALIA 51 49 <1 50 9 35 32 24 9 19 28 32 12 AUSTRIA 51 49 0 48 11 32 35 22 7 29 35 17 12 BELGIUM 50 50 0 49 12 32 32 24 10 29 14 32 15 BRAZIL 53 47 0 41 17 45 28 10 7 29 16 25 23 CANADA 51 49 <1 50 10 34 33 23 4 24 25 34 13 CHILE 51 49 <1 44 14 39 31 16 1 20 36 36 7 CHINA 51 49 0* 42 14 42 34 10 1 10 13 70 6 COLOMBIA 52 48 <1 43 18 39 29 14 5 19 32 35 9 54 46 <1 35 20 62 17 1 8 23 19 37 13 53 47 <1 49 7"
